num_comments,score,subreddit,title,is_nfl,date
46,1,fantasyfootball,"Boom, Bust, and Everything In Between – Tight Ends (2020 Fantasy Football)",0,2020-08-06
70,1,fantasyfootball,Why you shouldn't sleep on David Johnson,0,2020-08-06
31,1,fantasyfootball,Underrated offenses,0,2020-08-06
48,1,fantasyfootball,Best slot to draft from in a 12-team Snake this year?,0,2020-08-06
46,1,fantasyfootball,KC stacking,0,2020-08-06
37,1,fantasyfootball,Duke Johnson is the DJ to Own in Houston,0,2020-08-06
31,1,fantasyfootball,"Juju, Big Ben, James Conner and the Steelers are looking good for bounce back seasons in 2020",0,2020-08-06
61,1,fantasyfootball,"Official: [Keeper] - Fri , 08/07/2020",0,2020-08-07
146,1,fantasyfootball,"Official: [Who Do I Draft?] - Fri , 08/07/2020",0,2020-08-07
711,1,fantasyfootball,We may have seen the last of Bobby Sylvester of FantasyPros,0,2020-08-07
91,1,fantasyfootball,Warning signs of a bad hype train?,0,2020-08-07
326,1,fantasyfootball,Bobby Sylvester has been suspended indefinitely from FantasyPros,0,2020-08-07
236,1,fantasyfootball,"Washington Football RB Derrius Guice arrested on domestic violence charges, per Loudon County Sherrifs. Guice turned himself in Friday.",0,2020-08-07
97,1,fantasyfootball,Washington has released RB Derrius Guice.,0,2020-08-07
49,1,fantasyfootball,What is the consensus on Robert woods this year?,0,2020-08-08
205,1,fantasyfootball,Fantasy Pros fires Bobby Sylvester,0,2020-08-08
48,1,fantasyfootball,Good Football Podcasts Discussion?,0,2020-08-08
30,1,fantasyfootball,Rookie WR with the highest upside?,0,2020-08-08
89,1,fantasyfootball,"Official: [Who Do I Draft?] - Sat , 08/08/2020",0,2020-08-08
278,1,fantasyfootball,Who is everyone’s favorite late round WR? I’m loving the upside of Michael Pittman Jr. He could even be the one if Hilton goes down 👀,0,2020-08-08
36,1,fantasyfootball,"Antonio Gibson, Bryce Love Fantasy Football Outlook Without Derrius Guice",0,2020-08-08
42,1,fantasyfootball,Which fantasy rookies are you eyeing/avoiding in 2020?,0,2020-08-08
34,1,fantasyfootball,"Browns WR Jarvis Landry has passed his physical and is activated off of PUP, per source.",0,2020-08-08
41,1,fantasyfootball,Matthew Berry’s 2020 Draft-Day Manifesto,0,2020-08-08
44,1,fantasyfootball,My Top 20 RB Rankings - PPR,0,2020-08-08
53,1,fantasyfootball,Tiers for RB 1-25,0,2020-08-09
129,1,fantasyfootball,Garbage NFL.com just ruined our live draft,0,2020-08-09
82,1,fantasyfootball,"Official: [Keeper] - Sun , 08/09/2020",0,2020-08-09
187,1,fantasyfootball,"""Great news out of Bengals practice— A.J. Green looks like his old self.""",0,2020-08-09
29,1,fantasyfootball,Which RB would you take as your RB2 in full PPR?,0,2020-08-09
98,1,fantasyfootball,Who will be this year's Montee Ball or Zac Stacy?,0,2020-08-09
33,1,fantasyfootball,2-3 Turn Strategy (0.5 PPR - Picks 1-4),0,2020-08-09
286,1,fantasyfootball,[Louis Riddick] Chiefs RB Clyde Edwards-Helaire should be the first overall pick in fantasy drafts this season. I have had some success with taking rookie RB’s 1st overall in the draft in the past 🤔 @saquon ✌🏾,0,2020-08-09
155,1,fantasyfootball,Who is a good player that you won't have on any team this year?,0,2020-08-09
27,1,fantasyfootball,When Are You Drafting This Year?,0,2020-08-09
56,1,fantasyfootball,[YahooFantasy] Here's a look at which draft positions won the most fantasy championships in 2019. 🏆,0,2020-08-09
42,1,fantasyfootball,My Top 20 WR's PPR,0,2020-08-09
34,1,fantasyfootball,Discussion: Sell me for or against Kenny Golladay finishing in the top 10 WR in a half ppr,0,2020-08-09
53,1,fantasyfootball,Making some fantasy logos for the rest of the night,0,2020-08-10
32,1,fantasyfootball,"ESPN's John Keim reports Washington believes RB Peyton Barber has ""every-down ability.""",0,2020-08-10
97,1,fantasyfootball,What’s the earliest you’re willing to go QB this year?,0,2020-08-10
38,1,fantasyfootball,"ADP Draft Challenge, 8th Pick",0,2020-08-10
270,1,fantasyfootball,"[Adam Schefter]: “Chiefs and Texans open the NFL season Thursday, Sept. 10, one month from tonight.”",0,2020-08-10
127,1,fantasyfootball,"Official: [Keeper] - Mon , 08/10/2020",0,2020-08-10
108,1,fantasyfootball,"Official: [Who Do I Draft?] - Mon , 08/10/2020",0,2020-08-10
52,1,fantasyfootball,"Draft Steal Alert: Reach for DeVante Parker, League-Winning WR1",0,2020-08-10
27,1,fantasyfootball,"Derwin James needs knee surgery and will be out 6 - 8 months, per source.",0,2020-09-01
45,1,fantasyfootball,Fournette FAAB,0,2020-09-01
143,1,fantasyfootball,Kenyan Drake will 'stir the drink' for Arizona Cardinals offense,0,2020-09-01
52,1,fantasyfootball,NFL Redzone Access,0,2020-09-01
63,1,fantasyfootball,Has FantasyPros outlived its usefulness?,0,2020-09-01
111,1,fantasyfootball,Is there any scenario where Leonard Fournette ends up in a BETTER situation (fantasy wise) than when he was on the Jags?,0,2020-09-01
56,1,fantasyfootball,Am I missing something about Blake Jarwin?,0,2020-09-01
132,1,fantasyfootball,Unique Team Names Combining Players On Your Team,0,2020-09-01
47,1,fantasyfootball,So What’s Your League Doing If The Season Is Cancelled?,0,2020-09-01
29,1,fantasyfootball,Doubling up,0,2020-09-01
96,2,fantasyfootball,Who is the best player you would offer for Leonard Fournette right now?,0,2020-09-01
118,2,fantasyfootball,How would you guys feel about stacking Julio and Ridley?,0,2020-09-01
235,2,fantasyfootball,"Official: [Add/Drop] - Tue , 09/01/2020",0,2020-09-01
488,1,fantasyfootball,"Official: [Trade] - Tue , 09/01/2020",0,2020-09-01
341,1,fantasyfootball,"Official: [Who Do I Draft?] - Tue , 09/01/2020",0,2020-09-01
64,2,fantasyfootball,Gardner Minshew’s value?,0,2020-09-01
60,0,fantasyfootball,Who is the dark horse team for Fournette.,0,2020-09-01
72,2,fantasyfootball,Players With Lower Yahoo ADP than Consensus,0,2020-09-01
92,1,fantasyfootball,Watkins looking to be second starter over Mecole.,0,2020-09-01
83,1,fantasyfootball,"D'Andre Swift's return lasted one day, and now he's back on the mend. Won't practice today. Hasn't practiced on back-to-back days in about two weeks.",0,2020-09-01
34,1,fantasyfootball,gpngc's 2020 Fantasy Football Bold Predictions,0,2020-09-01
52,1,fantasyfootball,Is it normal to only draft 1 QB?,0,2020-09-01
42,1,fantasyfootball,Are 8 team leagues fun?,0,2020-09-01
47,1,fantasyfootball,"DeVante Parker was still not dressed for Miami Dolphins practice, instead working on a stationary bike",0,2020-09-01
56,1,fantasyfootball,DeVante Parker still dealing with 'minor injury',0,2020-09-01
42,1,fantasyfootball,"Crowder, Hogan, Herndon, Berrios all had tightness and were pulled out of practice. #nyj",0,2020-09-01
154,1,fantasyfootball,"[Jamison Hensley] John Harbaugh said rookie RB J.K. Dobbins will probably have a ""significant"" role this season. He raved about Dobbins' confidence and coachability.",0,2020-09-01
55,1,fantasyfootball,The 49ers remain hopeful Deebo Samuel will be ready for the season opener. Should avoid NFI.,0,2020-09-01
59,1,fantasyfootball,Darnold peppering Crowder with short yardage targets in scrimmage [video],0,2020-09-01
32,1,fantasyfootball,Late-(ish) Round RB strategy in PPR?,0,2020-09-01
36,1,fantasyfootball,I built a web app that allows you to see Fantasy Football leaders from every season.,0,2020-09-01
27,1,fantasyfootball,"Worth the RB advantage to go RB/RB round 1 and 2? Seems like WR is much deeper than RB this year, and unless you get top 2/3 TE, it's worth it to wait or stream.",0,2020-09-01
49,1,fantasyfootball,Ryquell Armstead not at Jags practice today,0,2020-09-01
109,1,fantasyfootball,Who is the breakout defense this year?,0,2020-09-01
310,1,fantasyfootball,"Hey, I'm Dan Harris, Editor-in-Chief of FantasyPros! AMA!",0,2020-09-01
87,1,fantasyfootball,"Adam Gase plans on getting Le'Veon Bell “out wide”, more often.",0,2020-09-01
142,1,fantasyfootball,Am I wrong in thinking Cam Newton has tremendous upside?,0,2020-09-01
46,1,fantasyfootball,Which Houston WR (if any) are you targeting this year?,0,2020-09-01
38,1,fantasyfootball,"Why Giants' Saquon Barkley could get 2,500 yards from scrimmage",0,2020-09-01
27,1,fantasyfootball,What do we think the best app is for this year?,0,2020-09-01
27,1,fantasyfootball,If the 2017 Draft Class Was a Fantasy Team,0,2020-09-01
29,1,fantasyfootball,Joe Mixon vs Alvin Kamara and their contract concerns,0,2020-09-01
49,1,fantasyfootball,Dez Bryant. Is he still making a comeback?,0,2020-09-01
31,1,fantasyfootball,Kenyan drake dropping adp?,0,2020-09-01
57,1,fantasyfootball,How early is too early to take Lamar Jackson?,0,2020-09-01
117,1,fantasyfootball,Do Drake owners really need to be getting Edmonds?,0,2020-09-01
43,1,fantasyfootball,"[Duncan] Mixon, Henry deals ‘similar’ to deal on table from Saints to Kamara",0,2020-09-01
33,1,fantasyfootball,"The Lions are signing LT Taylor Decker to a six-year, $85 million contract extension with $37.5M fully guaranteed.",0,2020-09-01
494,1,fantasyfootball,"I'm told the Saints are open to trading RB Alvin Kamara, per source.",0,2020-09-01
27,1,fantasyfootball,[Rapoport] Breaking: The Tampa Bay #Buccaneers have claimed RB Leonard Fournette off waivers. Brady gets his bell cow RB.,0,2020-09-01
56,1,fantasyfootball,Christian Mccaffrey under Teddy Bridgewater,0,2020-09-01
160,1,fantasyfootball,"Former Jaguars’ RB Leonard Fournette officially has filed a grievance against Jacksonville to try to recoup the $4.167 million in base salary that the team voided, per source.",0,2020-09-01
203,1,fantasyfootball,"On the Alvin Kamara situation with the #Saints, I'm told that right now, the team is comfortable making him a top 5 paid RB ($12+ mil per season). But Kamara's number is pushing more toward the #Panthers' Christian McCaffrey extension ($16+ mil per). That's a pretty wide chasm.",0,2020-09-01
39,1,fantasyfootball,Taysom Hill in a post-Kamara Saints Offense,0,2020-09-01
126,1,fantasyfootball,"Forty-five minutes past the waiver claim deadine and former #Jaguars RB Leonard Fournette has not been informed he’s been claimed. Generally, that’s a sign he’ll be a free agent.",0,2020-09-01
67,1,fantasyfootball,"[Schefter] Former Jaguars’ RB Leonard l officially went unclaimed on waivers today, per source. Fournette — who has rushed for 2,631 yards and 17 touchdowns since being drafted fourth overall in 2017 — is now a free agent.",0,2020-09-01
151,1,fantasyfootball,"The Raiders have placed WR Tyrell Williams on IR, ending his season.",0,2020-09-01
55,1,fantasyfootball,Mid-round QBs with huge upside.,0,2020-09-01
81,1,fantasyfootball,"Spoke to Saints RB Alvin Kamara and his agent and neither has asked for or demanded a trade. As of today, they thought they were actively negotiating and making progress on an extension. Kamara has never threatened to hold out and has been in the building every day.",0,2020-09-01
30,1,fantasyfootball,REAL auction values,0,2020-09-01
42,1,fantasyfootball,"I can confirm. Their first option is to sign Kamara to a long-term deal. But only at the right price. If not, they are open to a trade. Saints are seeking a first-round pick in return.",0,2020-09-01
36,1,fantasyfootball,Is it too late to get into Fantasy this year? Noob with some questions:,0,2020-09-01
35,1,fantasyfootball,A.J. Green still limited to individual drills,0,2020-09-01
27,1,fantasyfootball,Ty Montgomery,0,2020-09-01
56,1,fantasyfootball,Edwards/Ruggs Post-Williams IR,0,2020-09-01
54,1,fantasyfootball,Cam Akers,0,2020-09-01
34,1,fantasyfootball,"Updated Top 222 1/2 PPR rankings - Added Ozigbo - Moved down Cooks, Curtis Samuel",0,2020-09-01
32,1,fantasyfootball,Players with the best playoff schedule?,0,2020-09-01
154,1,fantasyfootball,#Saints RB Alvin Kamara intends to show up tomorrow and practice after missing several days following an epidural shot in his back last Thursday. The sides weren't that far apart on an extension before things went sideways.,0,2020-09-01
32,1,fantasyfootball,Risers &amp; Fallers: TE Edition,0,2020-09-01
48,1,fantasyfootball,Drafting A Quarterback Every Round,0,2020-09-02
266,1,fantasyfootball,"Joe Mixon and the terrible, horrible, no good, very bad fantasy ""analysis"" pervading this sub.",0,2020-09-02
78,1,fantasyfootball,Chris Carson ADP,0,2020-09-02
48,1,fantasyfootball,Is there a WR/RB to own in San Francisco?,0,2020-09-02
31,1,fantasyfootball,"Due to reported missed team obligations through the last 4 days, Saints RB Alvin Kamara will be fined $200K for said period. There's still potential for both sides to agree to an extension, if not options remain on the table for the club, per source, as previously stated.",0,2020-09-02
26,1,fantasyfootball,"After a wild few hours, all is quiet on the Alvin Kamara front. I'm told cooler heads have prevailed and the Saints and Kamara’s camp will keep working on a deal. He’s expected to be at practice tomorrow.",0,2020-09-02
57,1,fantasyfootball,I built a website with all the top fantasy twitter feeds so that you can easily find news about your players,0,2020-09-02
37,1,fantasyfootball,Pre draft trade,0,2020-09-02
26,1,fantasyfootball,What are the best free FF resources besides this subreddit?,0,2020-09-02
324,1,fantasyfootball,What is something that takes years of playing FF to understand?,0,2020-09-02
70,1,fantasyfootball,Pete Carroll says Chris Carson has looked good on every snap during training camp,0,2020-09-02
28,1,fantasyfootball,Are there any fantasy football games that operate in a same way to Premier League fantasy football?,0,2020-09-02
227,1,fantasyfootball,"Official: [Add/Drop] - Wed , 09/02/2020",0,2020-09-02
233,1,fantasyfootball,"Official: [Keeper] - Wed , 09/02/2020",0,2020-09-02
522,1,fantasyfootball,"Official: [Rate My Team] - Wed , 09/02/2020",0,2020-09-02
62,1,fantasyfootball,"Official: [Simple Questions and League Issues] - Wed , 09/02/2020",0,2020-09-02
235,1,fantasyfootball,"Official: [Who Do I Draft?] - Wed , 09/02/2020",0,2020-09-02
82,1,fantasyfootball,Who is your favourite double digit rookie WR?,0,2020-09-02
150,1,fantasyfootball,How many of you have used Zero RB strategy? What are your thoughts?,0,2020-09-02
329,1,fantasyfootball,(Week 1 DST Rankings),0,2020-09-02
175,1,fantasyfootball,What player is on your biased Do Not Draft list because they effed you over in the past?,0,2020-09-02
188,1,fantasyfootball,Patriots out on Fournette,0,2020-09-02
121,1,fantasyfootball,Question for the DJ Moore truthers out there?,0,2020-09-02
64,1,fantasyfootball,"I’m told contract talks may now begin between the Lions and star WR Kenny Golladay. The two sides have not yet begun on Golladay, and no deal is imminent.",0,2020-09-02
32,1,fantasyfootball,Leonard Fournette will NOT be picked up by a team... Here's why,0,2020-09-02
297,1,fantasyfootball,"#Bucs HC Bruce Arians says that the biggest thing for Ronald Jones is that he's really improved his hands in the passing game. There was one day where he was dropping passes but he fixed that. His blitz pickup has been good, he's looking like an all-around back.",0,2020-09-02
51,1,fantasyfootball,Adrian Peterson expected to be WFT's early-down RB,0,2020-09-02
99,1,fantasyfootball,CSG Fantasy Football Spreadsheet v8.07 (w/ GoogleSheet Auction version),0,2020-09-02
194,1,fantasyfootball,"Inside Injuries on Twitter: Most of the Alvin Kamara talk over the last few days has surrounded his contract talks with the #Saints, but far more concerning is the fact that he received an epidural shot in his back. This doesn't happen for just a little soreness or stiffness.",0,2020-09-02
147,1,fantasyfootball,BeerSheets 2020-09-02 (Nobody Likes Leonard Edition),0,2020-09-02
62,1,fantasyfootball,Carson was Limited Participant in practice today.,0,2020-10-01
65,1,fantasyfootball,Deandre Hopkins misses practice with ankle injury,0,2020-10-01
64,1,fantasyfootball,"2020 Fantasy Football Strategy: Week 4 Buy Low, Sell High Trade Targets - Roto Street Journal",0,2020-10-01
38,1,fantasyfootball,#Saints WR Michael Thomas (ankle) returned to practice today and was limited. Progress.,0,2020-10-01
67,1,fantasyfootball,"Anyone else wishing ESPN would allow the addition of an IR spot mid-season? This is now more relevant than ever, considering the recent COVID news. Let’s make some noise to get them to change this!",0,2020-10-01
294,1,fantasyfootball,Colts rookie running back Jonathan Taylor needs to step up his game,0,2020-10-01
48,1,fantasyfootball,".@Buccaneers HC @BruceArians told Bill Polian &amp; me on @SiriusXMNFL that he wasn't optimistic about Chris Godwin (hamstring) or Leonard Fournette (ankle) playing Sunday vs. the @Chargers, BA wonders whether Godwin's injury was altitude-related from last Sunday's game in Denver",0,2020-10-01
212,1,fantasyfootball,It sounds like Leonard Fournette could well be out for the Buccaneers on Sunday. Ronald Jones would be busy against the Chargers.,0,2020-10-01
50,1,fantasyfootball,Lets address the bear in the room,0,2020-10-01
172,1,fantasyfootball,Myles Gaskin Post-Game Analysis: Looking Ahead,0,2020-10-01
594,1,fantasyfootball,The worst hype train you’ve ever boarded ?,0,2020-10-01
186,1,fantasyfootball,"2020 Week 4 Consolidated Start 'Em, Sit 'Em - (FantasyPros, NFL, CBS, BleacherReport, SI, Sporting News)",0,2020-10-01
84,1,fantasyfootball,First fantasy football memories?,0,2020-10-01
45,1,fantasyfootball,Koo owners... wyd?,0,2020-10-01
69,1,fantasyfootball,Are you starting Michael Thomas,0,2020-10-01
150,1,fantasyfootball,Buy low on Cooks,0,2020-10-01
69,1,fantasyfootball,Qulio Jones - is he washed or a good target to buy?,0,2020-10-01
308,1,fantasyfootball,whats the biggest draft steal/early season waiver wire add that youve ever had?,0,2020-10-01
99,1,fantasyfootball,What is the Hype behind Damien Harris?,0,2020-10-01
122,1,fantasyfootball,Is it weird that Fantasy Football brings me so much joy?,0,2020-10-01
109,1,fantasyfootball,How do you guys handle unfair/anti-competitive trades?,0,2020-10-01
31,1,fantasyfootball,What should the Jets do?,0,2020-10-01
174,1,fantasyfootball,"Official: [Add/Drop] - Thu Morning, 10/01/2020",0,2020-10-01
33,1,fantasyfootball,"Official: [Fix My Team] - Thu Morning, 10/01/2020",0,2020-10-01
59,1,fantasyfootball,"Official: [Simple Questions and League Issues] - Thu Morning, 10/01/2020",0,2020-10-01
75,1,fantasyfootball,"Official: [Thursday Throwdown] - Thu Morning, 10/01/2020",0,2020-10-01
843,1,fantasyfootball,"Official: [Trade] - Thu Morning, 10/01/2020",0,2020-10-01
124,1,fantasyfootball,"Official: [WDIS K/TE/DEF] - Thu Morning, 10/01/2020",0,2020-10-01
81,1,fantasyfootball,"Official: [WDIS QB] - Thu Morning, 10/01/2020",0,2020-10-01
246,1,fantasyfootball,"Official: [WDIS WR] - Thu Morning, 10/01/2020",0,2020-10-01
157,1,fantasyfootball,"[Rapoport] Heading into tonight vs the #Broncos, #Jets coach Adam Gase's job status is not hanging in balance.",0,2020-10-01
169,1,fantasyfootball,"[Peliserro] #Jets WR Jamison Crowder, who missed two games with a hamstring injury, is expected to play tonight against the #Broncos, per source. Crowder won’t be 100%. But he’ll give it a go.",0,2020-10-01
48,1,fantasyfootball,My friend is a stats major and just told me that ECR is likely more accurate than the number 1 expert. My tiny brain cannot possibly comprehend that. That is just wrong right?,0,2020-10-01
73,1,fantasyfootball,DJ Chark listed as OUT this morning on Yahoo!,0,2020-10-01
32,1,fantasyfootball,What’s a fair way to start a league at this point in the season?,0,2020-10-01
114,1,fantasyfootball,"Undrafted RB @Robinson_jamess has been named @NFL Offensive Rookie of the Month for September. 339 scrimmage yards (210 rushing, 129 receiving) &amp; 3 TDs in three games.",0,2020-10-01
165,1,fantasyfootball,REMINDER that today marks the beginning of an important span of time in the fantasy season. October: The Month of Scary Terry.,0,2020-10-01
41,1,fantasyfootball,"Don't let last week's dud make you forget: Darren Waller led the Raiders in receiving with 18 catches for 150 yards over the first 2 games, and this week faces a Bills D that has allowed the 9th-most points to TEs",0,2020-10-01
29,1,fantasyfootball,Any news on Julio?,0,2020-10-01
67,1,fantasyfootball,"#Broncos RB Phillip Lindsay (turf toe) is considered unlikely to play tonight against the #Jets, per source. Lindsay has practiced the past week, is on the trip and feeling better. But it may make sense to hold him out another week. They'll talk before making a final decision",0,2020-10-01
1818,1,fantasyfootball,The NFL is rescheduling the Steelers-Titans game to later in the season after an additional Titans player and one personnel tested positive for COVID-19. It will not be played Week 4.,0,2020-10-01
26,1,fantasyfootball,What are commissioners doing to fairly deal with the rescheduled Titans-Steelers game?,0,2020-10-01
102,1,fantasyfootball,Holding PIT Defense?,0,2020-10-01
119,0,fantasyfootball,What is everyone doing about the postponed games?,0,2020-10-01
143,1,fantasyfootball,Who are your week 4 dart throws?,0,2020-10-01
209,1,fantasyfootball,"Be Aware, the Vikings could very well start testing positive later this week. Have backup plans for Cook and Thielen.",0,2020-10-01
26,1,fantasyfootball,Is anyone else have trouble with their Yahoo fantasy leagues this morning?,0,2020-10-01
156,1,fantasyfootball,Bold Predictions: Week 4,0,2020-10-01
50,1,fantasyfootball,Why a BYE and not OUT for Steelers/Titans?,0,2020-10-01
31,1,fantasyfootball,Ranking all 32 NFL offensive lines after Week 3 of the 2020 NFL season,0,2020-10-01
212,1,fantasyfootball,"Joe Burrow on struggling run game: That's something that we're putting an emphasis on, trying to get better. Obviously, our run game isn't what we expected. I know the O-line takes that to heart, Joe (Mixon) takes that to heart and everybody does. #Bengals",0,2020-10-01
35,1,fantasyfootball,What can we ACTUALLY expect from this weeks top waivers?,0,2020-10-01
61,1,fantasyfootball,TNF Fantasy Preview: Denver Broncos vs. New York Jets,0,2020-10-01
68,1,fantasyfootball,"Article #1 - Trying to understand James Robinson &amp; how to value him? Me too! So, I did. The DNA results are in, James Robinson is Frank Gore’s previously unknown child.",0,2020-10-01
90,0,fantasyfootball,"Early, but Julio Jones to the Pats? Breaking from Mo Chanel",0,2020-10-01
277,1,fantasyfootball,"Official: [Add/Drop] - Thu Afternoon, 10/01/2020",0,2020-10-01
75,1,fantasyfootball,"Official: [Fix My Team] - Thu Afternoon, 10/01/2020",0,2020-10-01
47,1,fantasyfootball,"Official: [Simple Questions and League Issues] - Thu Afternoon, 10/01/2020",0,2020-10-01
623,1,fantasyfootball,"Official: [WDIS Flex] - Thu Afternoon, 10/01/2020",0,2020-10-01
186,1,fantasyfootball,"Official: [WDIS K/TE/DEF] - Thu Afternoon, 10/01/2020",0,2020-10-01
82,1,fantasyfootball,"Official: [WDIS QB] - Thu Afternoon, 10/01/2020",0,2020-10-01
78,0,fantasyfootball,Must Starts | Week 4,0,2020-10-01
279,1,fantasyfootball,"Official: [WDIS RB] - Thu Afternoon, 10/01/2020",0,2020-10-01
377,1,fantasyfootball,"Official: [WDIS WR] - Thu Afternoon, 10/01/2020",0,2020-10-01
69,5,fantasyfootball,"Week 3 Snap Counts for All WR, RB, and TE with Percentages and Insights - Coop from Fantasy Alarm",0,2020-10-01
33,0,fantasyfootball,"So tired of the ""oh u have W and X out?"" ""try being me with W, X, Y, AND Z out"" cry baby comments that make up 98% of the threads here - Where my stacked teams at?",0,2020-10-01
52,1,fantasyfootball,NFL Week 4 Positional Rankings,0,2020-10-01
41,0,fantasyfootball,Can Players on Covid teams go on IR??,0,2020-10-01
68,0,fantasyfootball,Wow. Huge news. Per source: The #Patriots and #Falcons are engaged in serious conversations in regards to a trade involving Julio Jones. My source went on to add that this is pretty much a done deal. Will have more on this after the games Sunday. #NFL,0,2020-10-01
43,16,fantasyfootball,#Bills WR John Brown is practicing Thursday,0,2020-10-01
197,4,fantasyfootball,Were We Wrong To Be Excited About Joe Mixon?,0,2020-10-01
66,0,fantasyfootball,Leauge Manager meeting - what's your course of action for the game cancellation?,0,2020-10-01
31,0,fantasyfootball,How are the leagues handling the TEN/PIT situation?,0,2020-10-01
58,3,fantasyfootball,Patriots DST,0,2020-10-01
29,3,fantasyfootball,The Security Blanket known as Randall Cobb?,0,2020-10-01
303,31,fantasyfootball,"After much internal debate, we've [Sleeper] made a change to our COVID policy. We will give the COVID tag to all players with games postponed due to COVID. We will be making this change later today. Moving forward, it will be our policy to give the COVID tag to players on teams that have their game",0,2020-10-01
73,8,fantasyfootball,49ers Backfield,0,2020-10-01
47,12,fantasyfootball,"Good news from Falcons open practice period so far: Julio Jones, Russell Gage and Kaleb McGary are working with their position groups.",0,2020-10-01
48,19,fantasyfootball,ESPN Fantasy Sports Covid Update,0,2020-10-01
57,10,fantasyfootball,"Julio Jones (hamstring), Russell Gage (head) and Kendall Sheffield (foot) are practicing today.",0,2020-10-01
38,6,fantasyfootball,"Alshon Jeffery (foot), DeSean Jackson (hamstring), JJ Arcega-Whiteside (calf) and Trevor Williams (ribs) are not practicing today.",0,2020-10-01
57,17,fantasyfootball,"The Allen Robinson matchup is interesting to me this week. Colts against No. 1-type WRs so far this season: D.J. Chark 3 catches, 25 yards, 1 TD on 3 targets; Adam Thielen 3 catches, 31 yards on 8 targets If you know who NY's No. 1-type WR was last week, please let me know",0,2020-10-01
290,30,fantasyfootball,Yahoo Fantasy Care on Twitter: Only players who have been confirmed as testing positive for Covid will be given a Covid designation that is eligible for the IR. Entire teams will not be given this designation and will not be eligible for the IR if their game has been postponed due to Covid.,0,2020-10-01
