num_comments,score,subreddit,title,is_nfl,date
31,1,nfl,"Why so many people say that Rice is the greatest 49ers player of all time if was Joe the player who most changed the franchise´s history along with Walsh. I know that Rice was the best 49ers player ever, but best is different from greatest, right?",1,2020-08-01
129,1,nfl,"[Undisputed] ""I believe it's the greatest run for a QB. Drew Brees beat Kurt Warner in the divisional, who was a 2x league MVP, Brett Favre, and then he beat Peyton Manning. Those guys combined have 10 MVPs and 9 SB appearances on their resume.""",1,2020-08-01
164,1,nfl,"In history of NFL, only 9 players have ever won multiple NFL MVP awards. All these players are either in the Hall of Fame or 100% will be. Should winning multiple MVPs guarantee HOF enshrinement?",1,2020-08-01
42,1,nfl,"Most valuable QBs in 2019, per PFF WAR ➤ Russell Wilson ➤ Patrick Mahomes ➤ Dak Prescott ➤ Aaron Rodgers ➤ Lamar Jackson",1,2020-08-01
74,1,nfl,"J.K. Dobbins shocked by draft fall, but thinks Ravens are the right team for him",1,2020-08-01
104,1,nfl,"[kmeinke] Matt Patricia says he has talked to Da'Shawn Hand about a conspiracy video the lineman shared saying the coronavirus was a ""complete scam"" designed to crash economic systems. Hand didn't intend to push conspiracy theories, and Patricia has used it as a teaching moment.",1,2020-08-01
63,1,nfl,Who are your predictions for biggest busts and steals from the 2020 draft?,1,2020-08-01
39,1,nfl,Footballs First Star,1,2020-08-01
92,1,nfl,Was Peyton carried to both his Super Bowls?,1,2020-08-01
118,1,nfl,"[PFF] Most valuable QBs in 2019, per PFF WAR. Thoughts?",1,2020-08-01
81,1,nfl,"In 2013, the Kansas City Chiefs went 0-6 against horse teams",1,2020-08-01
65,1,nfl,"The HERD | Colin Cowherd :explain"" Why #4 Patrick Mahomes shouldn't be upset in NFL Top-100 ranking",1,2020-08-01
47,1,nfl,Offseason Review Series: Jacksonville Jaguars,1,2020-08-01
476,1,nfl,[Schefter] Dolphins’ first-round pick Tua Tagovailoa will graduate from the University of Alabama during a virtual commencement today and earn his Bachelor’s degree in communication studies.,1,2020-08-01
242,1,nfl,"[McBride] New: Wide receiver Marqise Lee is planning to opt out of the 2020 season, per league source. He is the seventh #Patriots player to make this choice.",1,2020-08-01
278,1,nfl,What is the best game you have ever watched??,1,2020-08-01
3358,1,nfl,Shitpost Saturday,1,2020-08-01
71,1,nfl,Punctured Lung Tony Romo Completes the Comeback Against the 49ers (2011),1,2020-08-01
415,1,nfl,Which NFL teams do you see moving on from their current starting QB after this season?,1,2020-08-01
575,1,nfl,"[Schad] Ryan Fitzpatrick: ""I know I am the placeholder for Tua Tagovailoa. I will be his biggest cheerleader when he gets in.""",1,2020-08-01
26,1,nfl,"[Garafolo] The #Giants have agreed to a two-year extension with OL Nick Gates, who started three games last year. The deal has a base value of $6.825 million and could max out at $10.325 million. A former undrafted free agent who spent his first year on IR, Gates cashes in.",1,2020-08-01
207,1,nfl,[Schad] Ryan Fitzpatrick says baseball issues are eye opening but not unexpected. Things are going to pop up. We have spoken so much about mitigating risk. If you test positive it doesn’t necessarily mean you were at a bar. Maybe you have five kids in school.,1,2020-08-01
248,1,nfl,Brees: Reaction to flag comment was 'crushing',1,2020-08-01
608,1,nfl,What are your top football pet peeves?,1,2020-08-01
176,1,nfl,Who was the best team to not make the Super Bowl?,1,2020-08-01
37,1,nfl,Why are the Dallas Cowboys the most valuable sports team?,1,2020-08-01
56,1,nfl,Bucs giving Last Chance U star John Franklin one more chance in the NFL,1,2020-08-01
50,1,nfl,"If or when this season gets cancelled, how do you think the NFL will determine draft pick order for next year?",1,2020-08-01
294,1,nfl,"[Cimini] Jets LB CJ Mosley has decided to opt out for 2020 due to family health concerns, sources tell ESPN.",1,2020-08-01
32,1,nfl,Key position battles at 2020 NFL training camp:,1,2020-08-01
87,1,nfl,"[Ellison] C.J. Mosley with the Ravens: 5 years, 4 Bowls for $17.5M ($3.5M per year) C.J. Mosley with the Jets so far: 2 games on a $85M contact ($17M per year)",1,2020-08-01
115,1,nfl,[Cardinals] Ladies and Gentlemen... @DeAndreHopkins in Red &amp; White,1,2020-08-01
60,1,nfl,"[Cabot] #Browns tight end David Njoku no longer wants to be trade, source tells me. He tweeted today: 'I'm all in Cleveland. Time to work'",1,2020-08-01
85,1,nfl,[Miami Dolphins] We have signed long snapper Rex Sunahara.,1,2020-08-01
33,1,nfl,[SI] Top 10 Miami Dolphins Players of All Time,1,2020-08-01
27,1,nfl,"[Schefter] Browns’ TE David Njoku, who requested a trade earlier this summer, has had “some good meetings with the new Browns’ organization including GM Andrew Berry and he has decided to give the team his full commitment right now and go from there,” said his agent, @RosenhausSports.",1,2020-08-01
70,1,nfl,How many Super Bowls has your team won? How many in your lifetime? How many do you actually remember?,1,2020-08-01
29,1,nfl,Can the NFL have a regional bubble with modified schedules or is it to late to figure something out?,1,2020-08-01
59,1,nfl,"[Schefter] Opt-out deadline for NFL players is now expected to be moved up to either Tuesday or Wednesday, per league sources, depending on talks this weekend. NFL is pushing to move up the deadline from one week after the new CBA side-letter is signed, and it now is expected even sooner.",1,2020-08-01
104,1,nfl,[Pelissero] My understanding is Matthew Stafford is asymptomatic. Every player who tests positive or has close contact with person(s) who did goes on the list.,1,2020-08-01
92,1,nfl,Which QB would you rather have going forward: Gardner Minshew or Sam Darnold?,1,2020-08-01
30,1,nfl,State of franchise: All eyes on Chicago Bears' QB battle | Pro Football Talk | NBC Sports,1,2020-08-01
36,1,nfl,Touchdown Pass Leaders and Passing yard leaders from 2016-2019 (Regular Season and Postseason),1,2020-08-01
54,1,nfl,Drew Brees Coy on Retiring from NFL After Saints' 2020 Season,1,2020-08-01
47,1,nfl,Texans' J.J. Watt says he feels as good as 2014-15 because of quarantine,1,2020-08-01
34,1,nfl,Sources: NFL opt-out deadline likely to move up,1,2020-08-02
55,1,nfl,Anyone who doesn't believe in the impact Clowney can have needs to watch this drive against the 49ers in Week 10,1,2020-08-02
80,1,nfl,Who would you rather have: Kittle or CMC,1,2020-08-02
236,1,nfl,[Lefkoe Show] Bart Scott says it is disrespectful to put any HOF Safety in the same sentence as Ed Reed.,1,2020-08-02
97,1,nfl,"[SharpFootball] Remember when GMs went after tall prototype QBs? The three QBs w arguably the most future upside also led the NFL in TD passes the last three years &amp; none have ""prototype"" height. most TDs in... 2017: 5-11"" Russell Wilson 2018: 6'3"" Patrick Mahomes 2019: 6'2"" Lamar Jackson",1,2020-08-02
227,1,nfl,[Highlight] NFL's Greatest Moments of the 2010s: Tim Tebow throws an 80 yard TD to Demaryius Thomas on the first play of OT in the playoffs against the Steelers (2011 Wild Card Round),1,2020-08-02
53,1,nfl,With reports of a coronavirus vaccine coming out before the end of the year how does this affect the league?,1,2020-08-02
173,1,nfl,"If you could choose one HOF player to be returned to their prime and added to your team's roster, who would it be?",1,2020-08-02
26,1,nfl,"One of the two Saints Jersey numbers retired is #31 Fullback Jim Taylor, who played only one season on the team (1967). Accumulating just 390 yds rushing, 2 TDs, and 251 yds receiving.",1,2020-08-02
115,1,nfl,Things are 'definitely' different for Deshaun Watson without Hopkins,1,2020-08-02
42,1,nfl,Every NFL Team's Secret Weapon for 2020,1,2020-08-02
91,1,nfl,Bears' Trubisky: Out to prove everyone wrong,1,2020-08-02
403,1,nfl,[Highlight] Younghoe Koo successfully kicks 3 onside kicks in a row against the Saints.,1,2020-08-02
3207,1,nfl,Sunday Brunch,1,2020-08-02
147,1,nfl,[Atlanta Falcons] The wait is over. Todd Gurley is reppin' the 🅰️.,1,2020-08-02
48,1,nfl,[Schefter] Bills’ GM Brandon Beane said CB EJ Gaines is opting out of the 2020 season.,1,2020-08-02
40,1,nfl,New Evidence: Key Fans Unhappy With Sports Leagues Kowtowing to Black Lives Matter,1,2020-08-02
77,1,nfl,5 young NFL QBs primed for breakout 2020 seasons,1,2020-08-02
199,1,nfl,[PFT] Source: NFL wants to shorten opt-out window because some players who fear they'd be cut are taking the stipend and others who want new deals are using a potential opt out as leverage,1,2020-08-02
30,1,nfl,[PFF] Lowest Passer Rating allowed by CBs,1,2020-08-02
31,2,nfl,"Colts Place T.Y. Hilton On Non-Football Injury List; Waive, Release Seven Players",1,2020-08-02
365,1,nfl,Who is the most overrated player in the NFL today? 2020 edition.,1,2020-08-02
26,1,nfl,Phillip Lindsay or Melvin Gordon? Broncos contend: 'You need two good backs',1,2020-08-02
302,1,nfl,"[Zhao] #Packers Matt LaFleur on Aaron Rodgers: ""Aaron is our quarterback and I see him here for a really long time.""",1,2020-08-02
182,1,nfl,"[Yates] Patriots TE Matt LaCosse is opting out of the 2020 season, per source. He becomes the 8th Patriot to make the decision to opt out.]",1,2020-08-02
65,1,nfl,[NFL Update] The #Steelers released former Ohio State QB JT Barrett and WR/KR Quadree Henderson.,1,2020-08-02
54,1,nfl,[Highlight] Saints undrafted rookie DT Shy Tuttle picks off Matt Ryan at the line then stiff arms him into oblivion on the return,1,2020-08-02
31,1,nfl,Who is the new Ryan Tannehill?,1,2020-08-02
53,1,nfl,Understanding the Brilliance of Carson Wentz's 2019 Season,1,2020-08-02
34,1,nfl,How Each NFL Stadium is Planning On Handling Fans due to Covid-19,1,2020-08-02
48,1,nfl,Most forgettable super bowls of all time (my top 5 ranking),1,2020-08-02
30,1,nfl,"[PFF] Most total pressures by an edge defender since 2015: Khalil Mack - 395, Von Miller - 385, Cameron Jordan - 371",1,2020-08-02
29,1,nfl,"[Highlight] Today could mark 39 days until the 2020 NFL Season begins. Let’s flashback to last year and George Kittle’s tackle breaking 4th down 39 yard rumble, the flashpoint of a wild 49ers/Saints game which had big NFC seeding ramifications.",1,2020-08-02
369,1,nfl,Larry Johnson’s antisemitic tweet.,1,2020-08-02
118,1,nfl,"[NFL Update] #Patriots center David Andrews, who was hospitalized with blood clots in his lungs late last August, says he will not opt out: “My choice has been made. It's something we feel comfortable with. I’m excited for the opportunity coming up.”",1,2020-08-02
44,1,nfl,Veteran RB Hill tweets he's signed with Raiders,1,2020-08-02
364,1,nfl,[Sicilliano] Minshew to the Covid list,1,2020-08-02
53,1,nfl,"[Jaguars] We have placed RB Ryquell Armstead, TE Charles Jones, QB Gardner Minshew II, WR Michael Walker and S Andrew Wingard on the Reserve/COVID-19 list.",1,2020-08-02
408,1,nfl,"[Kleiman] Devin @McCourtyTwins - ""Absolute joke that the NFL is changing the opt out period because they don’t want to see guys opt out ... I think it's terrible, I think it's BS.""",1,2020-08-02
34,1,nfl,"With so many opt-outs and many players inevitably getting sick and missing time throughout the season, what players do you hope to see take advantage of a chance to play?",1,2020-08-02
100,1,nfl,"[SteelersDepot] Ben Roethlisberger is the only QB in NFL history with more than two completions of 95-plus yards (3). Ben and Hall-of-Famer Joe Montana (2) are the only QBs to ever do it more than once, according to Pro-Football-Reference.",1,2020-08-02
30,1,nfl,[Schefter] Jaguars placed five players on the Reserve/COVID-19 list: QB Gardner Minshew II RB Ryquell Armstead TE Charles Jones WR Michael Walker S Andrew Wingard,1,2020-08-02
136,1,nfl,The Film Room Ep. 146 -- A deep study into why Drew Lock refuses to throw the ball deep,1,2020-08-02
60,1,nfl,Why Josh Allen is the next big thing,1,2020-08-02
179,1,nfl,"[Schefter] A surprise release: Jets are cutting last season’s starting right guard Brian Winters, per source. As a starting guard, Winters is not expected to be without a job very long.",1,2020-08-02
31,1,nfl,"[PFF] The Jets are releasing G Brian Winters, per @AdamSchefter Winters allowed 1 sack in 346 pass-blocking snaps last season",1,2020-08-02
42,1,nfl,"[Allegiant Stadium] The field tray, powered by 72 individual motors and weighing 19m pounds, is almost as heavy as the Eiffel Tower.",1,2020-08-02
40,1,nfl,"[OC] [Highlight] Today is CB Brandon Browner’s 36th birthday. Browner is best known for being a part of the Legion of Boom defense. He made the Pro Bowl with the Seahawks in 2011, and won back-to-back Super Bowls with the Seahawks and Patriots. Here’s every INT of Browner’s career",1,2020-08-02
110,1,nfl,"In 1955, the Pittsburgh Steelers drafted hometown Johnny Unitas. Their then head coach didn’t believe Unitas was smart enough to be a quarterback. Unitas didn’t play a single practice snap and was released before the season began.",1,2020-08-03
1007,1,nfl,"[Schefter] Eagles’ HC Doug Pederson has tested positive for the coronavirus, sources told ESPN’s @Tim_McManus. Pederson convened a previously unscheduled team meeting Sunday night to share the news with his players. He did this after receiving a second positive test.",1,2020-08-03
78,1,nfl,"[SharpFootball] A lot is made about the Washington losing Kyle Shanahan &amp; Sean McVay. The Bill Parcells-led Cowboys of 2005 had: • Sean Payton as OC • Mike Zimmer as DC • plus others below Jerry let all of them leave &amp; turned to Jason Garrett as OC, Brian Stewart as DC. (📷 @rmcameron89)",1,2020-08-03
48,1,nfl,"Who in your opinion, is the best free agent that is still available?",1,2020-08-03
73,1,nfl,Which pick from the 2020 Draft not related to your team or your rivals disappointed you?,1,2020-08-03
66,1,nfl,"Would you rather have a kicker that makes 100% of his kicks, but can only kick up to 40 yards, or a player that always makes 70% of his kicks regardless of distance, with a range of up to 70 yards?",1,2020-08-03
58,1,nfl,What College Football HC would make a great NFL Head Coach?,1,2020-08-03
31,1,nfl,[Megan Cloherty] Firm representing 15 fmr @WashingtonNFL employees says of talks with @NFL : “We also learned that the NFL has secured a critical agreement from the team to release employees or former employees from any non-disclosure agreement for ...speaking with the investigators,1,2020-09-01
442,1,nfl,[Rapoport] Source: #Chargers star S Derwin James needs surgery and is out 6 - 8 months. Brutal.,1,2020-09-01
45,1,nfl,Deion Sanders reacts to Leonard Fournette being Released,1,2020-09-01
47,1,nfl,Who are the most underrated players in the NFL?,1,2020-09-01
58,1,nfl,[Brady] Except for your boy...🏃💨 (In response to @Buccaneers Tweet),1,2020-09-01
28,1,nfl,"[Update] The #Bucs are signing former #Titans kicker Ryan Succup, per NFL Network. Matt Gay and Elliott Fry the other two kickers on Tampa’s current roster, but both have had their struggles at camp.",1,2020-09-01
65,2,nfl,Where to start?,1,2020-09-01
94,11,nfl,"[Bill Barnwell] Ryan Succop will be Tampa’s ninth kicker since the start of 2015. The league has hit 83.9% of their field goals over that timeframe. Not a single one of Tampa’s eight kickers have topped that mark. Combined, they’ve hit 73.7% of their kicks.",1,2020-09-01
85,2,nfl,"It might look like Jets are punting on 2020 NFL season, but there's a plan",1,2020-09-01
747,11,nfl,"[Highlight] NFL's Greatest Moments of the 2010s: Calvin Johnson has 329 receiving yards, most in decade and second most all time. Matthew Stafford's fake spike provides the winning TD against the Cowboys (2013 Week 8)",1,2020-09-01
500,15,nfl,NFL ROAST: Jacksonville Jaguars (22/32),1,2020-09-01
146,5,nfl,"[Hensley] At 60-to-1, Lamar Jackson’s odds to lead NFL in passing yards are the same as his odds to win the league’s rushing title ...",1,2020-09-01
178,1,nfl,[ESPN] 2020 NFL Rank: Predicting the NFL's best 100 players for this season,1,2020-09-01
80,1,nfl,"[Vacchiano] WRs Denzel Mims (hamstring) and Breshad Perriman (knee) remain out of Jets practice, with the season opener now just 12 days away.",1,2020-09-01
329,1,nfl,"[Kollmann] The Saints are currently projected to be 37.7 million OVER the cap next season before they do cuts and restructures. Brees would be a 22.6 million dollar dead cap hit if he retires. Kamara is amazing, but he's trying to get money that the Saints just don't have at this point.",1,2020-09-01
131,1,nfl,"[Breer] My understanding is 8 NFL coaches are hovering around or above $10M-per-year. The list... • Bill Belichick, Patriots • Pete Carroll, Seahawks • Jon Gruden, Raiders • John Harbaugh, Ravens • Sean McVay, Rams • Sean Payton, Saints • Andy Reid, Chiefs • Kyle Shanahan, 49ers",1,2020-09-01
46,1,nfl,"[Gallagher] Happy 47th, Zach Thomas! MLB, #Dolphins 1996-2007, Cowboys 2008 • All-Decade 2000s (Second-Team) • 7 Pro Bowls • 5x First-Team All-Pro • 1996 NFL All-Rookie Team • 1,727 career combined tackles • 1,035 solo tackles – most in Dolphins history • Miami Dolphins Honor Roll",1,2020-09-01
85,1,nfl,"[Machota] Jerry Jones usually hosts media members one night during camp at a bar/restaurant in California. When asked on @1053thefan about doing something similar in a safe way this year around Dallas: “Well, old Dr. Jones with my rubber glove is gonna make sure every one of you is safe.”",1,2020-09-01
39,1,nfl,Jerry Jones: We haven't had any direct discussions with Earl Thomas - ProFootballTalk,1,2020-09-01
39,1,nfl,Eagles to host fan cutouts at Lincoln Financial Field,1,2020-09-01
103,1,nfl,Jaguars player will honor David Dorn on his helmet: Report,1,2020-09-01
88,1,nfl,"PFF Rankings: The NFL’s top 25 cornerbacks ahead of the 2020 NFL season | NFL News, Rankings and Statistics | PFF",1,2020-09-01
4774,1,nfl,Talko Tuesday,1,2020-09-01
32,1,nfl,Colts All-Pro LB Darius Leonard Says He’s Been PED Tested Three Times in August,1,2020-09-01
32,1,nfl,Fournette landing spots,1,2020-09-01
98,1,nfl,"[Hensley] Mark Ingram remains the starting RB for Ravens, but coach John Harbaugh said rookie J.K. Dobbins is probably going to have ""a significant role."" ""Confidence plus coachability plus talent, that’s a pretty good combination and he’s got all of that,"" Harbaugh said of Dobbins.",1,2020-09-01
101,2,nfl,"[Daniels] What's different about the Patriots? Lamar Miller: I’d say the conditioning part. Since I’ve been in the league, I’ve never ran that much. It was just different for me. They make sure you’re in top, great shape. That’s something I haven’t experienced.",1,2020-09-01
26,1,nfl,[Cabot] Browns Kevin Stefanski said Myles Garrett (wrist) and Greedy Williams (shoulder) are day to day and he re-iterated that Garrett is nothing to worry about,1,2020-09-01
31,1,nfl,"[Cimini] Adam Gase admitted he didn't do a good job of utilizing Le'Veon Bell's receiving skills last year: ""I feel like we can find better ways to get him the ball to help him create more explosive plays. We can get him in space better than we did last year.""",1,2020-09-01
80,1,nfl,"[247] Report: Dwayne Haskins is ""firming his grip"" as the Washington Football Team's ""clearcut"" starting QB. He's ""looking increasingly sharp"" as a competition with Kyle Allen and Alex Smith winds down.",1,2020-09-01
29,1,nfl,"[Yates] The Vikings and starting LT Riley Reiff are closing in on a restructured contract to stay with the team, per league source. Minnesota keeps its stalwart offensive tackle.",1,2020-09-01
29,1,nfl,"[Berman] Pederson said Carson Wentz would typically take some rest this week (week of 4th preseason game). Said Wentz's injury is ""nothing major"" and will be ready to play.",1,2020-09-01
101,1,nfl,"[Rapoport] Riley Reiff’s agent Neil Cornrich called around on a potential trade, found no one would take on the $11M contract, and agreed to a pay cut despite the #Vikings LT having an emotional goodbye with teammates yesterday.",1,2020-09-01
53,1,nfl,"In a Land of "" I don't want a cable box"" How are people watching Football this season?",1,2020-09-01
362,1,nfl,"[Rapoport] The #Bengals are giving RB Joe Mixon a 4-year deal worth $48M, source said. A nice payday for their feature back, who is now under contract for 5 years.",1,2020-09-01
31,1,nfl,Can someone explain the hatred for Joe Buck?,1,2020-09-01
136,1,nfl,"[Karen Guregian] Asked to compare any similarities between Cam Newton and Tom Brady, Julian Edelman responded: “I’m not here to talk about players on other teams... I enjoy Cam. We’re going to leave it at that.”",1,2020-09-01
27,1,nfl,"Most yards per rush first two years, minimum 400 carries in NFL history",1,2020-09-01
166,1,nfl,"[Wilson] Roger Goodell said phrases ""End Racism"" and ""It Takes All of Us' will be in end zones in NFL stadiums this season.",1,2020-09-01
720,1,nfl,"[Anderson] I'm told the Saints are open to trading RB Alvin Kamara, per source.",1,2020-09-01
137,1,nfl,"[Schefter] Former Jaguars’ RB Leonard Fournette officially has filed a grievance against Jacksonville to try to recoup the $4.167 million in base salary that the team voided, per source.",1,2020-09-01
31,1,nfl,"[Breer] The 2014 National Champions ... Chargers DE Joey Bosa: 5 years, $135 million, Lions OT Taylor Decker: 6 years, $85 million, Cowboys RB Ezekiel Elliott: 6 years, $90 million, Saints WR Michael Thomas: 5 years, $96.25 million",1,2020-09-01
135,1,nfl,"[Robinson] On the Alvin Kamara situation with the #Saints, I'm told that right now, the team is comfortable making him a top 5 paid RB ($12+ mil per season). But Kamara's number is pushing more toward the #Panthers' Christian McCaffrey extension ($16+ mil per). That's a pretty wide chasm.",1,2020-09-01
50,1,nfl,[Update] The #Saints have made big trades in the past involving key offensive players. - They traded Jimmy Graham in 2015. - They traded Brandin Cooks in 2017. Got a first round pick back in both trades.,1,2020-09-01
60,1,nfl,"[Rapoport] Forty-five minutes past the waiver claim deadine and former #Jaguars RB Leonard Fournette has not been informed he’s been claimed. Generally, that’s a sign he’ll be a free agent.",1,2020-09-01
229,2,nfl,[Pelissero] Fournette has cleared the waivers; he is a free agegnt.,1,2020-09-01
70,1,nfl,"[Pelissero] The #Raiders put WR Tyrell Williams on season-ending injured reserve, ending his season.",1,2020-09-01
37,1,nfl,"[Robinson] Added context: #Saints are looking at the Mixon extension with the #Bengals as a starting point. Conversely, the angle of the Kamara camp is his overall impact on the offensive scheme is pretty unique in the NFL and capable of expanding considerably - making him a unicorn back.",1,2020-09-01
51,1,nfl,"[Rapoport] Spoke to #Saints RB Alvin Kamara and his agent and neither has asked for or demanded a trade. As of today, they thought they were actively negotiating and making progress on an extension. Kamara has never threatened to hold out and has been in the building every day.",1,2020-09-01
60,1,nfl,"[Verderame] My understanding is the Chiefs have potential interest in Leonard Fournette now that he's cleared waivers. The money would need to be right as he'd be backing up Clyde Edwards-Helaire, who has impressed considerably in training camp.",1,2020-09-01
322,1,nfl,[Bukowski] Imagine trading DeAndre Hopkins for David Johnson only to have Alvin Kamara come on the market that same offseason.,1,2020-09-01
74,1,nfl,"[Duncan] Saints first option is to sign Kamara to a long-term deal. But only at the right price. If not, they are open to a trade. Saints are seeking a first-round pick in return.",1,2020-09-01
203,1,nfl,"[Robinson] On Leonard Fournette after he went unclaimed on waivers: I'm told wherever he lands won't be a money decision. 2020 is going to be about scheme fit and the coaching staff that leans into a power running game. Opportunity will be important, but skill fit will be absolutely vital.",1,2020-09-01
387,1,nfl,Jerry Rice believes Jimmy G is a better quarterback than Dak Prescott,1,2020-09-01
103,1,nfl,Who still runs a more old school Power Run Scheme?,1,2020-09-01
29,1,nfl,"[PFF] Chris Godwin led the NFL in receptions gaining 20+ yards in 2019 (25) Tom Brady on passes targeted 20+ yards downfield since 2017: Small orange diamond 81 completions (2nd) Small orange diamond 2,546 YDS (5th) Looking forward to watching this duo in 2020",1,2020-09-01
39,1,nfl,"[PFF] In 2019, Matthew Stafford had a 94.1 overall PFF grade when kept clean in the pocket. Taylor Decker and the Lions agreed to a four-year, $60 million extension Tuesday. Making sure Stafford's blindside is protected for years to come.",1,2020-09-01
39,1,nfl,"With Taylor Decker being extended today, he becomes the only 1st round pick to be drafted and extended by the Lions since Brandon Pettigrew and Stafford in the 2009 draft",1,2020-09-01
80,1,nfl,[Pelissero] Alvin Kamara intends to show up tomorrow and practice after missing several days following an epidural shot in his back last Thursday. The sides weren't that far apart on an extension before things went sideways.,1,2020-09-01
228,1,nfl,[Derrick] The Chiefs Super Bowl ring features 255 diamonds and 36 rubies.,1,2020-09-01
42,1,nfl,Fox Shakes Up NFL Broadcast Teams for 2020 Season,1,2020-09-02
32,1,nfl,[Update] Trade: Washington has acquired OT David Sharpe and a 2021 seventh-round pick from the #Raiders for a 2021 sixth-round pick.,1,2020-09-02
88,1,nfl,"[Rocha] #Chiefs QB Patrick Mahomes proposes to high school sweetheart Brittany Matthews, per Instagram.",1,2020-09-02
68,1,nfl,Bears' Nagy clarifies he'll name QB next week,1,2020-09-02
