,clean_title,Target,prob_0,prob_1
569,cowboy run game established one nfl best,1,0.10197161219125728,0.8980283878087427
1728,official wdis k te def fri evening 10 08 2021,0,0.9160069865018461,0.08399301349815393
507,honest discussion 49ers stadium,1,0.48867744294130566,0.5113225570586943
887,game thread denver bronco 3 1 pittsburgh steelers 1 3,1,0.2485165620717964,0.7514834379282036
1221,team worst coaching coordinator offense far season,0,0.3795756388360537,0.6204243611639463
1804,chris carson go ir russell wilson,0,0.6075751810228591,0.39242481897714093
1480,stunner patriot releasing four time pro bowl cornerback stephon gilmore eligible come physically unable perform list week 6 source tell espn,0,0.3927032418497952,0.6072967581502048
686,injury russell wilson's finger throwing hand appears dislocated,1,0.692108590492685,0.307891409507315
1576,wr cb matchup chart week 5,0,0.700554272758229,0.299445727241771
1701,christopher harris accuracy,0,0.5763209965525373,0.42367900344746273
853,team never super bowl best chance getting first ring year,1,0.23726225180891913,0.7627377481910809
241,highlight daniel jones 52 yard bomb bomb john ross touchdown,1,0.06464952756187814,0.9353504724381219
1072,celebrating life mike tagliere live memorial service,0,0.3926446992842264,0.6073553007157736
1017,official wdis wr fri evening 10 01 2021,0,0.9160069865018461,0.08399301349815393
1354,austin ekeler,0,0.5763209965525373,0.42367900344746273
996,mile sander,0,0.5763209965525373,0.42367900344746273
141,head coach team hired made think person never last nfl person ended much better job expected also head coach assumed would sucessfull ended complete bust,1,0.07760270627290677,0.9223972937270932
483,mueller watched juju pay woman entire cart grocery south side gianteagle find debit card sent friend check car came behind line hoody one realized paid question asked,1,0.4835824397584363,0.5164175602415637
574,rapaport deal official tomorrow morning jaylon smith indicated green bay want packer beef lb corp former pro bowler,1,0.8378008162856662,0.1621991837143338
1371,official wdis k te def tue morning 10 05 2021,0,0.9326777443864642,0.06732225561353578
381,highlight charger called facemask,1,0.04650343980995819,0.9534965601900418
506,best officially full decade ny metro area nfl mlb nba nhl championship first time occurred since 1905 21,1,0.22696187939623236,0.7730381206037676
1235,talk disappointing early round pick far,0,0.5367266557901037,0.4632733442098963
1305,bengal rb joe mixon diagnosed low grade ankle sprain leave week week per source,0,0.8865706681437913,0.11342933185620875
456,yates 8 player season least 5 catch every game davante adam dj moore justin jefferson deebo samuel cooper kupp calvin ridley brandin cook hunter renfrow,1,0.4636925109694504,0.5363074890305496
1905,cart coming taysom hill,0,0.5763209965525373,0.42367900344746273
1294,ty'son williams thought week 4,0,0.8118826102652941,0.18811738973470593
53,andrew perloff end day tom brady goon tom thug want rip patriot face head win three four touchdown that's exactly he's going rodney harrison dpshow,1,0.17387525490080158,0.8261247450991984
1256,ty son williams pain thread,0,0.6407902372944906,0.3592097627055094
1234,per game average year nick chubb 17 3 carry 1 0 target 97 0 yard scrimmage 39 1 team red zone opportunity kareem hunt 10 8 carry 3 8 target 88 8 yard scrimmage 21 7 team red zone opportunity,0,0.17550569113257786,0.8244943088674221
202,highlight eagle punt fake result brian dawkins touchdown,1,0.09908712845170298,0.900912871548297
1672,official wdis k te def fri morning 10 08 2021,0,0.9326777443864642,0.06732225561353578
1588,darnell mooney jerk circ full swing,0,0.5763209965525373,0.42367900344746273
164,mcclain watched texan next qb desmond ridder lead cincinnati victory notre dame,1,0.42088517365543965,0.5791148263445604
960,questionable player drop seen competitive league far,0,0.6071838905787157,0.39281610942128425
1058,rostering latavius murray,0,0.5763209965525373,0.42367900344746273
1580,week 5 wr cb matchup full 50 player cb ranked 1 50,0,0.700554272758229,0.299445727241771
171,redditcfb urban meyer trending twitter due video wife,1,0.2492184007738606,0.7507815992261394
1864,code red buffalo bill kansa city chief snf game tonight fall extreme criterion heavy rainfall likely impact player production 0 37 rainfall expected fall game make condition difficult player,0,0.40228537983499046,0.5977146201650095
37,opinion trevor lawerence like joe burrow break second year taking lump first year,1,0.3505204562526254,0.6494795437473746
321,bill bellicheck,1,0.5763209965525373,0.42367900344746273
1861,official wdis rb sun morning 10 10 2021,0,0.9463043768534442,0.05369562314655588
339,guregian bruce arians said surprised bill belichick nick folk attempt 56 yard fg end arians said saw folk make 60 yarder direction warmups,1,0.46086948214952705,0.539130517850473
1854,week 5 wr cb matchup full 50 player cb ranked 1 50 part 2,0,0.700554272758229,0.299445727241771
499,best team rarely super bowl 2000s,1,0.38353756358981694,0.6164624364101831
1183,panther running back christian mccaffrey hamstring today made trip dallas there's chance could return next week maybe likely two week he's field going stretching routine,0,0.7218544317994124,0.27814556820058756
1747,ram st get point last night blocked punt,0,0.5763209965525373,0.42367900344746273
146,tom brady used play patriot,1,0.21741874081186718,0.7825812591881328
1609,official fix team thu evening 10 07 2021,0,0.8783473444146983,0.1216526555853017
1801,diggs top 5 wr ro,0,0.6102906436001387,0.3897093563998613
297,highlight tom brady get sacked matt judon 8 yard loss,1,0.0311348202226317,0.9688651797773683
217,game thread kansa city chief 1 2 philadelphia eagle 1 2,1,0.2485165620717964,0.7514834379282036
881,highlight kyle pitt go deep,1,0.09908712845170298,0.900912871548297
1064,last week explored playoff odds change record week determine important week's matchup tldr closer 500 important week's matchup peaking week 13 getting 8 5 v 7 6 change playoff odds 53,0,0.700554272758229,0.299445727241771
191,si apparent video urban meyer getting danced woman bar going viral,1,0.2492184007738606,0.7507815992261394
983,jamison crowder expected play looking good saleh say,0,0.5763209965525373,0.42367900344746273
866,highlight zach wilson picked jaylinn hawkins,1,0.09908712845170298,0.900912871548297
1724,official fix team fri evening 10 08 2021,0,0.8783473444146983,0.1216526555853017
96,sport book brady belichick showdown heavily bet game,1,0.14024761334532942,0.8597523866546706
1214,logan thomas hamstring questionable,0,0.678513967641268,0.32148603235873197
1185,lions' d'andre swift track play week 4,0,0.700554272758229,0.299445727241771
1518,league member passed away,0,0.5763209965525373,0.42367900344746273
1167,what's bold prediction week 4,0,0.700554272758229,0.299445727241771
1653,pete carroll call wilson's injury badly sprained finger we've got figure '',0,0.692108590492685,0.307891409507315
56,pft tom brady surpasses brett favre sacked quarterback nfl history profootballtalk,1,0.05256673055694716,0.9474332694430528
1610,official simple question league issue thu evening 10 07 2021,0,0.9160069865018461,0.08399301349815393
925,nfl twitter tom brady antonio brown connect gobucs,1,0.12437457631454729,0.8756254236854527
132,greatest suprise nfl playoff superbowl upset remember team people thought chance ended knocking favored team,1,0.14632887375097436,0.8536711262490256
1065,raider wr taking gamble,0,0.5763209965525373,0.42367900344746273
1447,overrating dallas pas catcher season,0,0.47397990086590147,0.5260200991340985
665,brandon staley strong contention coty success first year coach would winning superbowl first year take cake,1,0.2502678942167277,0.7497321057832723
955,joe mixon 3 reception 6 yard last 3 game 17 game pace including week 1 30 reception 123 receiving yard,0,0.7941500792090762,0.20584992079092382
225,football medium going infinitely better tb v ne game,1,0.3679253705048259,0.6320746294951741
612,lamar jackson would 2019 nfl mvp without leg,1,0.10786832082553932,0.8921316791744607
184,next coach jacksonville,1,0.40035271674941464,0.5996472832505854
1155,official fix team sun morning 10 03 2021,0,0.9016905049858243,0.0983094950141757
962,cowabunga bad word espn fantasy,0,0.823664921724358,0.17633507827564196
102,burrow herbert closeness,1,0.5386647450730596,0.4613352549269404
527,new york giant daniel jones named nfc offensive player week,1,0.5867806573687098,0.41321934263129023
1742,trey sermon droppable,0,0.5763209965525373,0.42367900344746273
1141,bobby tree excellent game tomorrow holding setup sell high,0,0.4440419946789771,0.5559580053210229
1883,matthew berry twitter cook left field working start doubt,0,0.6441848553163083,0.3558151446836917
1066,tonyan cooked,0,0.5763209965525373,0.42367900344746273
896,espn stats amp info trey lance 4th youngest qb make 1st career start super bowl era since 1966 1 day younger alex smith 1st career start 49ers smith threw 0 td 4 int 28 3 loss colt oct 9 2005,1,0.2690027065978907,0.7309972934021093
846,next expansion imagining structure 36 team nfl,1,0.14632887375097436,0.8536711262490256
1401,stream consciousness week 5 discussion checklist top pick st kicker,0,0.700554272758229,0.299445727241771
1224,49ers te george kittle officially active rb elijah mitchell inactive san francisco's available rb trey sermon jacques patrick trenton cannon,0,0.7501356195749513,0.24986438042504872
610,espn really find anyone better dan orlovsky,1,0.534038142787528,0.46596185721247196
800,oc bill belichick tried fool tom brady film breakdown belichick constantly rushed 3 bumped tampa receiver lb sent exotic blitz,1,0.5357602739858849,0.46423972601411506
718,another team's lowlight can't stand watch,1,0.4738415415894859,0.5261584584105141
1517,anyone worried russel wilson ram,0,0.5763209965525373,0.42367900344746273
522,rapoport jaguar coach urban meyer addressed full team today express remorse responsibility action weekend source said,1,0.059443369856692185,0.9405566301433078
961,handle multiple player team lineup,0,0.4738415415894859,0.5261584584105141
1105,evan engram rostered player fantasy football opportunity knocking,0,0.823664921724358,0.17633507827564196
1404,borischen co week 5 tier,0,0.700554272758229,0.299445727241771
55,kenny golladay better amari cooper best wide receiver nfc east,1,0.3853319849353807,0.6146680150646193
1920,titans' aj brown say snap count today wanted snap say he's quite 100 percent yet,0,0.5763209965525373,0.42367900344746273
1660,stevens great news jerry jeudy moving around well enough dance little bit,0,0.39910639232304124,0.6008936076769588
1908,patriot injury update rb damien harris chest questionable return,0,0.885977183157249,0.11402281684275095
1332,cordarrelle patterson value,0,0.720980818418463,0.2790191815815371
1917,worth rb elijah mitchell first line starting offense final warmups mitchell back shoulder injury week,0,0.8558601908799395,0.1441398091200605
471,olinestats stand rodney hudson nfl line player started every game allowed pressure season also yet allow sack tfl,1,0.1019260937190406,0.8980739062809594
1556,mid season name change guy consider kosher change team name swap drop player served inspiration assuming every competent owner sub player pun team name,0,0.6438769690032821,0.35612303099671794
705,patrick daugherty russell wilson chris carson held team back long,1,0.506177886522995,0.493822113477005
268,shout andrew thomas playing like legit franchise lt season,1,0.47397990086590147,0.5260200991340985
1488,darnell mooney become bears' wr1,0,0.5763209965525373,0.42367900344746273
1291,zimmer think dalvin cook's ankle reason minnesota struggled generate ground game think issue came game one time little gimpy took said good went back,0,0.6581456591661454,0.3418543408338546
1123,bold prediction week 4,0,0.700554272758229,0.299445727241771
90,prime chad johnson prime brandon marshall prime demaryius thomas,1,0.5763209965525373,0.42367900344746273
1106,start sits week 4,0,0.700554272758229,0.299445727241771
973,official wdis wr fri morning 10 01 2021,0,0.9326777443864642,0.06732225561353578
904,highlight ben roethlisberger strip sacked denver recovers,1,0.05005923114789024,0.9499407688521098
668,nickelodeon congrats week 4 nflslimetime nvp dak prescott dallascowboys,1,0.700554272758229,0.299445727241771
1127,dk metcalf manager concern foot issue,0,0.5763209965525373,0.42367900344746273
1553,fairest trade seen season,0,0.47397990086590147,0.5260200991340985
1125,worst fantasy player rostered holding,0,0.823664921724358,0.17633507827564196
1021,carolina defense actually good rush,0,0.5763209965525373,0.42367900344746273
1269,arizona wr 4 game conveniently ordered receiving yard green 15 248 2 24 target kirk 16 244 2 18 target hopkins 17 225 3 25 target moore 16 211 1 18 target,0,0.4122733567900573,0.5877266432099427
1382,wright waiver week five,0,0.8118502962825251,0.1881497037174748
468,last twenty dolphin game tua play one quarter 7 3 play le one quarter 4 6,1,0.4440419946789771,0.5559580053210229
404,weinfuss one undefeated team left nfl arizona cardinal,1,0.14632887375097436,0.8536711262490256
605,schefter former cowboy lb jaylon smith officially reached agreement morning one year deal green bay packer per source,1,0.13537180484377032,0.8646281951562297
1664,le'veon bell staying practice squad week,0,0.700554272758229,0.299445727241771
1038,tennessee receiver pickup aj julio,0,0.5763209965525373,0.42367900344746273
1410,london game,0,0.4440419946789771,0.5559580053210229
1726,official trade fri evening 10 08 2021,0,0.9160069865018461,0.08399301349815393
1833,guy dropping ty'son,0,0.5763209965525373,0.42367900344746273
1769,russel wilson,0,0.5763209965525373,0.42367900344746273
284,tom brady passed drew brees time passing yard,1,0.15260211188612038,0.8473978881138796
1015,official wdis qb fri evening 10 01 2021,0,0.9221668803787882,0.07783311962121177
1178,start sits sleeper advice week 4,0,0.700554272758229,0.299445727241771
263,highlight justin field continues hot today hit allen robinson huge throw,1,0.11210354982547988,0.8878964501745201
330,mike reiss tom brady 114 1 leading 3 quarter gillette stadium loss 2017 week 1 v chief,1,0.2695721311236958,0.7304278688763042
501,todd archer reminder cowboy could cut jaylon smith offseason wrist surgery 2020 season $7.2 fully guaranteed,1,0.3078042200652016,0.6921957799347984
558,garafolo urban meyer fly back home jaguars' plane thought time chance everybody clear head including,1,0.23311601330348442,0.7668839866965156
1362,waiver period end time,0,0.7029057244100898,0.29709427558991025
413,raider loved la,1,0.5763209965525373,0.42367900344746273
1222,player switched midgame nfl app wtf,0,0.20566261906100414,0.7943373809389959
1498,v1per's week 5 survivor eliminator pick,0,0.700554272758229,0.299445727241771
1336,patterson london,0,0.720980818418463,0.2790191815815371
1050,official fix team sat morning 10 02 2021,0,0.9016905049858243,0.0983094950141757
509,many current qbs make throw,1,0.5763209965525373,0.42367900344746273
352,mac jones comparable qb trevor lawrence year,1,0.3464160203337503,0.6535839796662497
1581,brown qb baker mayfield wearing shoulder harness play suffered partially torn labrum left shoulder sept 19 v texan source say surgery needed listed report injury missed practice snap,0,0.4627942713698955,0.5372057286301045
656,b r charger head coach brandon staley talk run game important,1,0.1296159678290656,0.8703840321709344
58,best philip river mic'd v raider y'all think that's good blitz,1,0.48446957704574134,0.5155304229542587
264,gehlken cowboy cb trevon diggs becomes first player franchise history record interception team's first four game season,1,0.26357023833229853,0.7364297616677015
1531,mike davis owner week,0,0.8515610822170139,0.14843891778298615
1762,official wdis rb sat morning 10 09 2021,0,0.9463043768534442,0.05369562314655588
322,tom brady become 4th qb nfl history beat 32 team,1,0.049022763963893046,0.950977236036107
1503,ty hilton outlook,0,0.6929571424253174,0.3070428575746826
1736,breakdown every rosterable nfl player ever played london game start em,0,0.1319606196964549,0.8680393803035451
353,9news sport denver watch bronco sideline enraged raven decided run ball final play game rather take knee,1,0.38131324354797935,0.6186867564520206
1667,official add drop fri morning 10 08 2021,0,0.9326777443864642,0.06732225561353578
170,redditcfb urban meyer trending twitter due video wife,1,0.2492184007738606,0.7507815992261394
215,dov kleiman according jayglazer tom brady specifically asked patriot make brief pause break time passing yard record big ceremony like drew brees saint,1,0.24117284387786875,0.7588271561221313
911,highlight trevor lawrence corner end zone duuuval,1,0.08619096575735641,0.9138090342426436
485,guy week 1 hot take looking 4 week season,1,0.607800354611385,0.39219964538861496
1510,bronco qb teddy bridgewater progressing concussion protocol feeling better expected practice today source said drew lock take first team rep,0,0.5192612033184824,0.48073879668151764
1016,official wdis rb fri evening 10 01 2021,0,0.9327646818960222,0.06723531810397775
1490,what's strategy lance garoppolo 2qb superflex league,0,0.5763209965525373,0.42367900344746273
1306,anyone also holding chubb hunt stack rb combo thinking,0,0.7501356195749513,0.24986438042504872
1396,dolphin sending wr jakeem grant bear 2023 sixth rounder per source,0,0.5763209965525373,0.42367900344746273
259,nfl cordarrelle patterson third td beauty ceeflashpee84 dirtybirds,1,0.2725842724619708,0.7274157275380292
1337,consolidated week 5 waiver wire ranking,0,0.8118502962825251,0.1881497037174748
35,deadspin tua bust kind go display canton injured playing mediocre football,1,0.4978337533170808,0.5021662466829192
1527,jeff wilson timeline,0,0.5763209965525373,0.42367900344746273
776,former jaguar tight end praying urban meyer amid 'heartbreaking' bar scandal,1,0.2492184007738606,0.7507815992261394
1399,derrick henry usage,0,0.39209266286308453,0.6079073371369155
1668,official fix team fri morning 10 08 2021,0,0.9016905049858243,0.0983094950141757
893,talented quarterback entering draft 1st round would want drafted,1,0.40781046355926764,0.5921895364407324
1342,official monday night football postgame thread,0,0.8769961906798539,0.12300380932014608
1119,key fantasy football wr wide matchup week 4,0,0.8893016660140697,0.11069833398593036
565,trask urban meyer's abandonment jaguar duty real issue,1,0.2492184007738606,0.7507815992261394
1151,49ers te george kittle listed questionable sunday due calf injury play v seahawks per source,0,0.7499440913595323,0.2500559086404676
719,watching terrible season,1,0.47397990086590147,0.5260200991340985
1489,meinke pro bowl center frank ragnow placed injured reserve first time career yet another blow detroit,0,0.5546988525738223,0.4453011474261777
648,hall famer end career micah parson lawrence taylor serious,1,0.5763209965525373,0.42367900344746273
1473,official wdis k te def wed morning 10 06 2021,0,0.9326777443864642,0.06732225561353578
221,game thread detroit lion 0 3 chicago bear 1 2,1,0.2485165620717964,0.7514834379282036
1067,week 4 start sits sleeper,0,0.700554272758229,0.299445727241771
526,ben baby bengal qb joe burrow named afc offensive player week,1,0.4550617798034031,0.5449382201965969
1882,klis courtland sutton playing playing today looked good pregame test 9sports,0,0.5763209965525373,0.42367900344746273
1924,injury update saquon barkley questionable return ankle injury,0,0.7783943852472137,0.22160561475278634
1113,schefter bucs te rob gronkowski suffered multiple fractured rib last sunday threaten sideline multiple week source tell espn,0,0.5230893175169656,0.47691068248303436
1844,mile sander owner putting faith boobie one time,0,0.7581821270154573,0.24181787298454274
111,fan complain owner favorite team worst two group score bonusfinder ranked owner here's plot showing ranking worst owner upper right plot best owner lower left plot,1,0.6102835789777633,0.3897164210222367
662,winningest punter time,1,0.5546988525738223,0.4453011474261777
1116,te replacing gronk,0,0.6164384839537416,0.3835615160462585
537,oc four rookie quarterback starting compare previous first round quarterback first four game,1,0.22092065218629742,0.7790793478137026
787,highlight kyler murray back foot christian kirk big gain 4th 5 keep drive alive,1,0.0728023001283169,0.9271976998716831
1331,vic tafur twitter raider head back locker room weather delay,0,0.5763209965525373,0.42367900344746273
1589,top 5 qbs order ro,0,0.6102906436001387,0.3897093563998613
1301,kyle pitt still given,0,0.5763209965525373,0.42367900344746273
95,penei sewell play good enough,1,0.5763209965525373,0.42367900344746273
559,kleiman also noteworthy bucs front recent instagram follows gilmore bruce arians jason licht,1,0.29106872385362004,0.70893127614638
1863,schefter russell wilson's doctor believe seattle seahawks qb realistic chance return four week per source,0,0.43335604781003545,0.5666439521899646
696,keep geno smith last drive 5 5 72 yard td,1,0.2966976656394844,0.7033023343605156
161,lazar along gronk bucs also ruled jason pierre paul jpp make trip,1,0.6164384839537416,0.3835615160462585
1203,'experts' low dallas st,0,0.5763209965525373,0.42367900344746273
285,highlight brady pass drew brees career pas yard history nfl,1,0.03884254762255879,0.9611574523774412
597,qb playing worse year matt ryan big ben,1,0.20825591205687433,0.7917440879431257
852,schefter packer awaiting decision whether standout cb jaire alexander need season ending surgery per source,1,0.23690131365383116,0.7630986863461688
1093,colt officially placed pro bowl guard quenton nelson injured reserve,0,0.5763209965525373,0.42367900344746273
1495,david montgomery trade value,0,0.5763209965525373,0.42367900344746273
1084,official fix team sat evening 10 02 2021,0,0.8783473444146983,0.1216526555853017
560,dirocco urban meyer said earn player trust back said gotten 8 10 phone call player last several day supportive,1,0.2492184007738606,0.7507815992261394
156,tom brady completes double pas catching pas week 11,1,0.3233272889282073,0.6766727110717927
561,siciliano urban meyer say fined owner shad khan say discussed staying ohio gm trent baalke way advance,1,0.6114996961640711,0.3885003038359289
1889,rb antonio gibson wr curtis samuel active,0,0.7501356195749513,0.24986438042504872
1909,cardinal rb chase edmonds shoulder te maxx williams shoulder active today v 49ers,0,0.8405069453542606,0.15949305464573943
459,silver one player told 'he zero credibility stadium little begin ',1,0.48867744294130566,0.5113225570586943
252,many mahomes tds actually shovel pass,1,0.5763209965525373,0.42367900344746273
530,anderson understanding sfa cb stephon gilmore set earn $7 base salary season looking earn least $15 year open market several team look bolster secondary attrition already kicking week 5,1,0.1816946434108363,0.8183053565891637
1543,let hear favorite fantasy pick time,0,0.8105155616490312,0.18948443835096881
1138,wft rb antonio gibson listed questionable sunday due shin injury expected play v falcon barring pregame setback per source,0,0.868751102603136,0.13124889739686396
1397,bear rb damien williams suffered thigh bruise week 4 ok source confirmed david montgomery 4 5 week per dangrazianoespn here's look bears' running back depth chart damien williams khalil herbert ryan nall practice squad,0,0.8838011472911578,0.1161988527088422
1424,te waiver move week 5 updated rest season te ranking week 5 ranking included coop fantasy alarm,0,0.9005369245800494,0.09946307541995061
783,england people popular football play,1,0.4978337533170808,0.5021662466829192
1790,official wdis wr sat evening 10 09 2021,0,0.9160069865018461,0.08399301349815393
1161,official wdis wr sun morning 10 03 2021,0,0.9326777443864642,0.06732225561353578
824,rapoport raider veteran te derek carrier headed injured reserve torn pec suffered last week source said season ending injury hit la vega depth,1,0.32711111568988394,0.6728888843101161
804,brett kollmann think ruined panther,1,0.5763209965525373,0.42367900344746273
1092,high ceedee lamb,0,0.5763209965525373,0.42367900344746273
1211,official wdis wr sun evening 10 03 2021,0,0.9160069865018461,0.08399301349815393
873,schefter raider qb derek carr discus contract extension la vega raider season,1,0.24801544829910716,0.7519845517008928
1259,raven week 4 rb opportunity latavius 18 le veon 5 freeman 1 ty son healthy scratch,0,0.7752880020907318,0.2247119979092682
1102,los angeles ram elevated running back buddy howell playstation szn,0,0.5763209965525373,0.42367900344746273
1100,jonathan taylor,0,0.5763209965525373,0.42367900344746273
516,highlight aaron rodgers' first career start threw ridiculous touchdown pas 2008 v viking,1,0.08605982586940975,0.9139401741305903
977,worry robert wood,0,0.5763209965525373,0.42367900344746273
660,pff highest passer rating blitzed kyler 158 3 wilson 148 1 mahomes 137 2,1,0.3995096821507328,0.6004903178492672
814,16 team double digit number player injury report week titan lead 23,1,0.6767630015236599,0.3232369984763402
878,matt ryan becomes seventh quarterback nfl history 5 000 completion pass eli manning 8th time passing yard,1,0.06757385785426162,0.9324261421457384
1147,waddle waddle waddle,0,0.5763209965525373,0.42367900344746273
379,highlight j herbert pas short middle parham 4 yard touchdown charger,1,0.026737343382796763,0.9732626566172032
1482,reddit adjusted trade value week 5 mixon mixoff,0,0.7905834508494444,0.20941654915055563
974,good joe mixon played 40 55 snap 11 53 1 second half good mixon played 3 9 third snap third amp short two target game,0,0.563095257865664,0.43690474213433605
1195,anybody else firing pat tonight,0,0.5763209965525373,0.42367900344746273
