,clean_title,Target,prob_0,prob_1
212,kleiman rob gronkowski 4 cracked rib one broken punctured lung according jayglazer,1,0.5763209965525373,0.42367900344746273
711,ram tonight's sack aaron donald time sack leader rams' history,1,0.5546988525738223,0.4453011474261777
251,highlight mahomes find fortsun td chief extends lead,1,0.09908712845170298,0.900912871548297
40,would lesean mccoy 1st team decade old format,1,0.4738415415894859,0.5261584584105141
1340,faab weekly consensus thread week 4,0,0.6195020151577116,0.38049798484228836
1702,raven oc greg roman running back pecking order like slightly different style starting learn one,0,0.5763209965525373,0.42367900344746273
465,silver said one player urban meyer's apology woman video 'we looked like wtf right left everyone started dying laughing knew ',1,0.2492184007738606,0.7507815992261394
1293,dawson knox might actual te1,0,0.5763209965525373,0.42367900344746273
174,tom brady tampa bay buccaneer defeat new england patriot tomorrow brady become fourth quarterback time get quarterback win every current nfl team,1,0.032239394890084094,0.9677606051099159
1032,reid say chief josh gordon play week add he's good shape 'knocking rust off',0,0.700554272758229,0.299445727241771
74,baldwin nfl team good pas protection pas block win rate pff grade tell different story graph,1,0.0713360482182468,0.9286639517817532
