,clean_title,Target,prob_0,prob_1
1265,year nfl sleeper,0,0.11461340728024283,0.8853865927197572
1080,rob gronkowski making trip new england bucs te looking replace lineup,0,0.5531133428687567,0.44688665713124337
10,redskin fire marty shottenheimer managed turn redskin season around second half make team 8 8 2001,1,0.4180380023127571,0.5819619976872429
1562,deshaun watson ir stash next 4 week,0,0.700554272758229,0.299445727241771
1445,cooper kupp underrated 23 whatever,0,0.5763209965525373,0.42367900344746273
1035,cryptic tweet le veon,0,0.5763209965525373,0.42367900344746273
1419,tomlin say roethlisberger hip injury,0,0.692108590492685,0.307891409507315
856,game thread new york jet 1 3 atlanta falcon 1 3,1,0.23130262787563804,0.768697372124362
1643,geno smith qb seattle,0,0.3788986776443536,0.6211013223556464
834,start trey lance type determine garappolo's fate spot start till return,1,0.5763209965525373,0.42367900344746273
838,team best offensive defensive player worst offensive defensive,1,0.2626244579926187,0.7373755420073813
1174,player starting week score least point,0,0.700554272758229,0.299445727241771
1514,raider rb peyton barber impressed filling josh jacob diagnosed mild turf toe source say fracture still seeking opinion test sound like week sideline,0,0.8408429026427638,0.15915709735723613
14,explain like i'm five make nfl coach different college coach,1,0.11274982224303476,0.8872501777569652
211,game thread game hub redzone week 4,1,0.49903464809614206,0.5009653519038579
242,highlight michael carter get endzone first nfl touchdown jet first td season,1,0.056727820185377587,0.9432721798146224
870,highlight zach wilson friendly fire,1,0.09908712845170298,0.900912871548297
1416,thread 1 urban meyer situation jacksonville reached crisis point especially locker room one player told 'he zero credibility stadium little begin ',0,0.13964093853345205,0.860359061466548
1271,official add drop mon morning 10 04 2021,0,0.9326777443864642,0.06732225561353578
923,highlight burrow chase 70 yard td bomb,1,0.06464952756187814,0.9353504724381219
435,oc nfl average point scored v allowed week 4,1,0.22591374811908338,0.7740862518809166
1241,mo alie cox played 69 percent snap today season turned 3 catch 42 yard two touchdown,0,0.36153546182819263,0.6384645381718074
1312,sam darnold player nfl history 5 rushing 5 passing tds first 4 game season,0,0.1019260937190406,0.8980739062809594
1001,player ro valuation reality check,0,0.6102906436001387,0.3897093563998613
1461,crowder v c davis debate,0,0.5763209965525373,0.42367900344746273
1663,ram look different,0,0.5763209965525373,0.42367900344746273
1907,uphold trade 1 player's game started,0,0.4440419946789771,0.5559580053210229
706,highlight lockett try sell contact,1,0.09908712845170298,0.900912871548297
965,official fix team fri morning 10 01 2021,0,0.9016905049858243,0.0983094950141757
1028,gronkowski owner worried missing weekend,0,0.7739503219649562,0.2260496780350439
1433,ir stashed week 5,0,0.700554272758229,0.299445727241771
694,schefter let geno cook,1,0.2937060698158668,0.7062939301841332
683,jamal adam still top 10 safety,1,0.44647118539088737,0.5535288146091126
1778,built free chrome extension let see live fantasy score nfl stream need keep checking fantasy apps let switch stream easily clicking fantasy player hypeshot io,0,0.6294886580225495,0.3705113419774505
937,bench rondale moore week 3,0,0.7298169815589111,0.2701830184410889
815,trotter brown lt jedrick will ruled tomorrow charger,1,0.3406920185576432,0.6593079814423568
309,sick brady belicheck boring game tired watching guy wish step aside retire every medium outlet talked game wayyyy much week give u something new,1,0.3089596819292746,0.6910403180707254
233,highlight jalen hurt find dallas goedert eagle touchdown,1,0.09908712845170298,0.900912871548297
1150,49ers rb elijah mitchell listed questionable sunday due shoulder injury sunday v seahawks per source,0,0.868751102603136,0.13124889739686396
663,mom woman urban meyer video worried daughter's 'emotional status',1,0.2824649014253864,0.7175350985746136
172,favorite era nfl,1,0.20566261906100414,0.7943373809389959
625,2019 2020 first rounder taken step forward taken step back,1,0.5763209965525373,0.42367900344746273
1649,dk metcalf tonight 5 target 5 catch 2 tds 98 yard multiple big play ramsey 5 tds 5 game,0,0.36881042024047717,0.6311895797595228
1172,bronco droppable going forward,0,0.5763209965525373,0.42367900344746273
728,highlight every lost fumble week 4 set yakety sax,1,0.14355016699148748,0.8564498330085125
1232,sunday night gamethread week 4,0,0.700554272758229,0.299445727241771
872,cimini zach wilson 4th qb throw interception first 5 career game last 10 season joining deshone kizer 2017 zach mettenberger 2014 blake bortles 2014,1,0.2273334340112445,0.7726665659887555
1190,ffnow dangrazianoespn reporting bal den game expects latavius murray lead bal backfield touch today personally i'd avoid whole backfield today possible,0,0.4872172623457752,0.5127827376542248
180,pft gronk reportedly could miss week fractured rib bucs play three game next 12 day put ir,1,0.7397509417731154,0.2602490582268846
1635,idp know missing something fantasy football life,0,0.5562209289280707,0.44377907107192927
1859,official wdis k te def sun morning 10 10 2021,0,0.9326777443864642,0.06732225561353578
1355,myles gaskin week 5 tb,0,0.700554272758229,0.299445727241771
1406,sutton believe,0,0.5763209965525373,0.42367900344746273
1152,rapoport new chief receiver josh gordon impressed already much could activated next week,0,0.3394130205898316,0.6605869794101684
371,myles garrett go sleeveless one game hit got random drug test morning http co p3i2emhufd,1,0.5222149845904815,0.4777850154095185
584,school project need see passing yard tds chief since 1970 2020 page like basketballreference find stats,1,0.46086948214952705,0.539130517850473
116,nfl coverage map week 4,1,0.22591374811908338,0.7740862518809166
1309,bear hc matt nagy reiterated reporter today andy dalton starter he's healthy,0,0.5127300123666279,0.4872699876333722
1716,ill fated add drop trade far year,0,0.36678906462124283,0.6332109353787572
1744,r wilson owner backup qb confident,0,0.7567731892683655,0.24322681073163455
1090,official wdis rb sat evening 10 02 2021,0,0.9327646818960222,0.06723531810397775
1821,deebo could play key supporting role lance's first start,0,0.5763209965525373,0.42367900344746273
1192,talking chief folk linc backing rapsheet say josh gordon arrived incredible shape guy played almost two year 7 percent body fat 230 pound freakish,0,0.40480113162625553,0.5951988683737445
572,chase claypool first one family go finish college graduated one prestigious university world bought parent brand new car age 21 age 22 bought family house losing still never heard,1,0.5531133428687567,0.44688665713124337
1655,schefter seahawks qb russell wilson never missed nfl start something could jeopardy finger injury,0,0.23997934725025272,0.7600206527497473
880,game thread game hub redzone week 5,1,0.49903464809614206,0.5009653519038579
1435,saint signing rb ozigbo jag practice squad,0,0.7501356195749513,0.24986438042504872
1699,curtis samuel back field,0,0.5763209965525373,0.42367900344746273
1019,aiyuk deebo kittle miss time,0,0.5546988525738223,0.4453011474261777
746,deforest buckner lamar jackson elite qb got treat like running back,1,0.6087917269125438,0.3912082730874562
697,rapoport seahawks star qb geno smith thrown 9 pass 2018 tonight 9 pass 3 year well rested tonight heroic,1,0.08679892767404884,0.9132010723259512
1741,2 wrs would trade dk metcalf,0,0.5763209965525373,0.42367900344746273
1730,best play regard streaming qbs,0,0.48446957704574134,0.5155304229542587
687,highlight tyler higbee get td,1,0.15072953551737955,0.8492704644826204
1376,trade value tuesday week 5 return ben baby edition,0,0.5285077852460033,0.4714922147539967
1798,profootball doc 2021 return jeff wilson jr optimistic,0,0.5763209965525373,0.42367900344746273
1311,talk time talk x player post got stop,0,0.5546988525738223,0.4453011474261777
475,garafolo trade likely cowboy already explored option source say balance $7.2 million base salary season plus $9.2 million injury guarantee next year latter part huge reason team moving right,1,0.6374259706486737,0.3625740293513263
926,highlight chase 70 yard bomb burrow,1,0.06464952756187814,0.9353504724381219
203,meirov storyline today besides brady belichick andy reid return philly kevin stefanski return minnesota roethlisberger v rodgers first time since super bowl xlv 2011 saint first home game since hurricane ida undefeated ram v undefeated cardinal,1,0.14024761334532942,0.8597523866546706
540,water cooler wednesday,1,0.5763209965525373,0.42367900344746273
859,calldine appears falcon forgot kicking net improvised one using two step ladder goal net,1,0.5763209965525373,0.42367900344746273
1598,nbc sport edge football jag oc bigger role shenault,0,0.4978337533170808,0.5021662466829192
1627,think there's optimism chris carson gonna play tonight seattle seahawks rapsheet,0,0.5803160770469646,0.4196839229530354
671,morning game snack,1,0.5222149845904815,0.4777850154095185
907,highlight can't stop davis mill hope contain 67 yd td pas,1,0.09908712845170298,0.900912871548297
415,manzano charger hc brandon staley weather delay said hey guy going chapter book weather delay dome stadium,1,0.266354358762504,0.733645641237496
639,nfl's tv rating 17 season,1,0.1619836677833969,0.8380163322166031
216,game thread tennessee titan 2 1 new york jet 0 3,1,0.23130262787563804,0.768697372124362
1439,javonte williams v melvin gordon,0,0.7193620196196853,0.2806379803803147
1515,charger defense held every opponent lowest point total season,0,0.2550086635882961,0.7449913364117039
1722,sterling shepard darius slayton jabrill pepper side today training staff would think ruled later today hamstring injury appear making significant progress especially shepard we'll see,0,0.7861167925015,0.21388320749850004
439,budowsky dolphin took ronnie brown aaron rodgers three year later took jake long matt ryan taking tua herbert nothing,1,0.3447364514453477,0.6552635485546523
1375,ask doctor ppr right expected fantasy point shakedown different scoring system,0,0.823664921724358,0.17633507827564196
1557,player overvalue team,0,0.4738415415894859,0.5261584584105141
340,next gen stats bill belichick's decision try 56 yd fg 45 make probability instead going 52 conversion probability suboptimal decision according ng decision guide win go 34 7 win fg 24 3 recommendation go 10 3 tbvsne,1,0.5075128366189889,0.492487163381011
969,official wdis flex fri morning 10 01 2021,0,0.9326777443864642,0.06732225561353578
178,kyed chief ruled de frank clark db charvarius ward elevated db dicaprio bootle practice squad,1,0.5763209965525373,0.42367900344746273
5,rapoport jaguar wr dj chark suffered fractured ankle source said indefinitely brutal injury one jacksonville best player,1,0.4288869053648472,0.5711130946351528
1328,bronco qb teddy bridgewater uncertain recovery timeline drew lock preparing he'll start steelers week 5,0,0.6801051252124151,0.3198948747875849
820,evan lazar patriot downgraded db jalen mill lb ronnie perkins houston make trip,1,0.5763209965525373,0.42367900344746273
908,john breech jameis winston experience continues interception 72 yard td lost fumble first quarter even saint wft,1,0.42042190819833736,0.5795780918016626
570,urban meyer home dinner wright thompson 2012,1,0.2492184007738606,0.7507815992261394
311,gayle jeremiah owusu koramoah insane today enter week 5 pff's highest graded linebacker,1,0.533634489173217,0.466365510826783
715,official authority eject fan game,1,0.8313458773882041,0.16865412261179585
1347,4 0 club represent,0,0.5763209965525373,0.42367900344746273
414,interesting afc north stats,1,0.5272176174957881,0.4727823825042119
479,slater confirm source tell cowboy tried unsuccessfully trade jaylon smith everything asked ultimately play guy like keanu neal leighton vander esch told perhaps increased use jabril cox led move bc,1,0.31606299854161346,0.6839370014583865
1783,official fix team sat evening 10 09 2021,0,0.8783473444146983,0.1216526555853017
1437,data visualization show brown rb split hunt chubb 2020,0,0.7501356195749513,0.24986438042504872
1053,official wdis flex sat morning 10 02 2021,0,0.9326777443864642,0.06732225561353578
17,hughes former jet te chris herndon 0 catch three game season douglas got fourth rounder,1,0.3460071867831426,0.6539928132168574
1441,worst week 4 roster player least 95 owned,0,0.700554272758229,0.299445727241771
54,free talk friday,1,0.5763209965525373,0.42367900344746273
1773,weapon healthy joe burrow top 10 qb play packer missing jaire alexander za darius smith,0,0.3841724179053494,0.6158275820946506
1452,yahoo fantasy continual rolling list waiver,0,0.8634606464211798,0.1365393535788202
1027,julio aj brown week,0,0.700554272758229,0.299445727241771
1835,playing two running back backfield minimize risk,0,0.6180595761006626,0.3819404238993373
308,hope cowboy win,1,0.5075128366189889,0.492487163381011
1477,official wednesday weekly trade value wed morning 10 06 2021,0,0.9326777443864642,0.06732225561353578
383,highlight darren walker called taunting foul,1,0.09908712845170298,0.900912871548297
794,rap significant next week nfl taking another critical step toward playing regular season game germany possibly 2022 tuesday unveil 3 finalist city league say committed multiple game london season plus game mexico city,1,0.18304755947743756,0.8169524405225624
1300,unsolicited thought zack moss,0,0.5763209965525373,0.42367900344746273
1239,bear rb david montgomery believed avoided major knee injury,0,0.8322478562844356,0.16775214371556432
909,ari meirov antonio brown reached 900 career reception he's fastest player nfl history reach milestone antonio brown 143 game marvin harrison 149 game,1,0.1319606196964549,0.8680393803035451
462,silver player particularly put fact meyer canceled monday's team meeting dealt uproar video young woman getting cozy ohio bar 'he even canceled team meeting scared ' player said,1,0.35330151402894483,0.6466984859710552
68,win mean tom brady bill belichick legacy,1,0.17387525490080158,0.8261247450991984
1759,official wdis flex sat morning 10 09 2021,0,0.9326777443864642,0.06732225561353578
1196,trenton cannon might get significant snap rb today 49ers lot chatter niner circle sermon's ineffectiveness last week,0,0.81455875539833,0.18544124460166997
1351,4 game season top buy low candidate right,0,0.3460071867831426,0.6539928132168574
591,susel kyler murray team success start season used winning feel right feel normal,1,0.4180380023127571,0.5819619976872429
1465,qbs would want ro,0,0.6102906436001387,0.3897093563998613
567,nfl team could add cap gofundme,1,0.14632887375097436,0.8536711262490256
725,rodrigue robert wood 12 14 150 yard last night said approached sean mcvay good talk week getting involved passing game heavier involvement run game,1,0.6376906188274698,0.3623093811725302
2,coincidence golden tate auden tate au chemical symbol gold nfl wide receiver,1,0.20566261906100414,0.7943373809389959
822,indianapolis colt technically dayton triangle,1,0.5763209965525373,0.42367900344746273
1575,think passive v active management,0,0.5763209965525373,0.42367900344746273
1574,official wdis wr thu morning 10 07 2021,0,0.9326777443864642,0.06732225561353578
701,highlight geno smith ball picked,1,0.03941474972670367,0.9605852502732963
261,yates raven rb ty son williams inactive today bronco,1,0.8405069453542606,0.15949305464573943
151,highlight joe burrow mic'd v jaguar can't zero blitz put hand,1,0.09908712845170298,0.900912871548297
917,highlight joe burrow go taking huge shot,1,0.09908712845170298,0.900912871548297
613,thursday talk thread yes that's thread name,1,0.48629970840687,0.51370029159313
1764,toney golladay underrated week,0,0.700554272758229,0.299445727241771
1456,𝐓𝐄 𝐘𝐃𝐒 𝐑𝐄𝐂𝐄𝐈𝐕𝐈𝐍𝐆 𝐓𝐫𝐚𝐯𝐢𝐬 𝐊𝐞𝐥𝐜𝐞 𝟑𝟏𝟐 darren waller 274 mark andrew 253 george kittle 227 j hockenson 215 dalton schultz 201 kyle pitt 189 dallas goedert 188 rob gronkowski 184 mike gesicki 184,0,0.5763209965525373,0.42367900344746273
139,nfl matchup kliff kingsbury spread offense azcardinals almost demand 5 db account speed mattbowen41 highlight k1 ability hit wr christian kirk route spite tight cover 1 man coverage,1,0.07296787146891692,0.9270321285310831
182,highlight theismann hilariously say danny woodhead's last name wrong deion absolutely loses point laying floor,1,0.09908712845170298,0.900912871548297
1455,nfl trade,0,0.20566261906100414,0.7943373809389959
1656,whoever benched robert wood tonight thank,0,0.5763209965525373,0.42367900344746273
1148,obi wan jakobi afc east wr,0,0.5272176174957881,0.4727823825042119
956,despite never leading game bengal ran 55 play tonight,0,0.4440419946789771,0.5559580053210229
1320,ram successful long term find people named kupp,0,0.5763209965525373,0.42367900344746273
884,game thread new england patriot 1 3 houston texan 1 4,1,0.15031710102727602,0.849682898972724
1665,soooooo david montgomery going placed ir,0,0.5763209965525373,0.42367900344746273
1711,bengal wr tee higgins looked great week play sunday per zac taylor,0,0.5332160308620361,0.46678396913796394
1289,bear believe rb david montgomery tore acl testing today determine extent injury per source,0,0.8322478562844356,0.16775214371556432
108,condense expand evolution justin herbert joe lombardi charger offense,1,0.3072660151749409,0.6927339848250591
860,highlight kyle pitt first nfl touchdown,1,0.11021668513856309,0.8897833148614369
1060,chance den bal qb show game,0,0.4205643009054034,0.5794356990945966
487,great team,1,0.305422431008338,0.694577568991662
1405,cut list time let go,0,0.5546988525738223,0.4453011474261777
458,oc nfl standing amp point differential chart 4 week,1,0.22591374811908338,0.7740862518809166
1735,fantasy app service suggests trade based opponent's need,0,0.823664921724358,0.17633507827564196
721,eagle currently track 3 top 10 pick 2022 nfl draft,1,0.20566261906100414,0.7943373809389959
239,highlight zach wilson picked,1,0.09908712845170298,0.900912871548297
578,calvert socialight lamar jackson written children's book,1,0.4402485426279833,0.5597514573720167
280,highlight pat fan booing brady come first drive,1,0.055436151974946,0.944563848025054
1544,week league's playoff begin,0,0.700554272758229,0.299445727241771
1252,thought eli mitchell,0,0.5763209965525373,0.42367900344746273
863,schefter source derek carr discus contract extension la vega raider season,1,0.2662874333241174,0.7337125666758826
1926,injury update saquon barkley ruled ankle injury,0,0.7247237893297643,0.27527621067023567
1333,hartitz j mckissic carry inside five 10 yard line antonio gibson season,0,0.36153546182819263,0.6384645381718074
351,stats stats mac jones patriot completed 70 0 percent pass far year 112 160 that's highest completion percentage qb nfl history first 4 career game min 100 attempt,1,0.055560317299486295,0.9444396827005137
1257,official sunday night football postgame thread,0,0.8769961906798539,0.12300380932014608
97,schefter bucs officially listing te rob gronkowski doubtful sunday night matchup v patriot,1,0.3539599206693488,0.6460400793306512
970,official wdis k te def fri morning 10 01 2021,0,0.9326777443864642,0.06732225561353578
193,schefter bucs quarterback tom brady set nfl time passing record sunday night former team need 68 yard patriot pause acknowledge stop game ceremony,1,0.01192516264931387,0.9880748373506861
1463,travis kelce practicing josh gordon run route man like laugh i'm watching something i've never seen like poetry motion,0,0.5763209965525373,0.42367900344746273
1532,4 week revisiting 5 grain preseason take,0,0.700554272758229,0.299445727241771
1198,expecting week 4 performance javonte williams ty son pitt taylor,0,0.8118826102652941,0.18811738973470593
536,espn nfl team least analytics advanced surveyed 22 team staffer,1,0.14632887375097436,0.8536711262490256
1697,joe mixon practice hoodie practicing though bengal,0,0.6870139402750419,0.3129860597249581
126,daniel wallach city st louis move sanction nfl team owner jerry jones robert kraft john mara clark hunt noncompliance court ordered discovery seek striking pleading entry default judgment,1,0.3014031334661017,0.6985968665338983
1327,official trade mon evening 10 04 2021,0,0.9160069865018461,0.08399301349815393
554,urban meyer disastrous head coach hire nfl history,1,0.030077772324516694,0.9699222276754833
1169,week 4 wr cb matchup full 50 player cb ranked 1 50 part 2,0,0.700554272758229,0.299445727241771
606,nfl power ranking first quarter 21 season,1,0.1619836677833969,0.8380163322166031
989,fuller play sunday,0,0.5763209965525373,0.42367900344746273
1024,viking listing rb dalvin cook questionable sunday game v cleveland,0,0.784318415710903,0.215681584289097
1777,caution amari cooper,0,0.5763209965525373,0.42367900344746273
402,highlight charger wit da pooch punt v raider rub face even,1,0.04650343980995819,0.9534965601900418
185,time great db v wr match,1,0.37819796729830635,0.6218020327016937
463,pelissero statement jaguar owner shad khan,1,0.780019244194952,0.219980755805048
355,michael giardi mac jones 15 19 156 yard td int versus blitz tonight blitzed 47 7 pct dropbacks per nextgenstats jones hit 12 time tonight patriot,1,0.43908978696740086,0.5609102130325991
1814,49ers actually prefer rb committee examining game game rb touch distribution since 2019,0,0.6380414189901018,0.36195858100989825
898,highlight big ben 50 yard bomb diontae td,1,0.03569395556025068,0.9643060444397493
901,highlight saint fan can't make mind jameis winston,1,0.09908712845170298,0.900912871548297
1202,update ne kicker situation,0,0.5763209965525373,0.42367900344746273
1170,sure handed tim patrick emerges bronco receiving pillar thanks work ethic underdog mindset,0,0.5763209965525373,0.42367900344746273
1329,monday night gamethread week 4,0,0.700554272758229,0.299445727241771
1903,ignoring trade offer,0,0.5763209965525373,0.42367900344746273
1409,patterson rb wr eligible espn,0,0.8508113785534115,0.14918862144658857
1094,dj moore v trevon diggs,0,0.6202093433896823,0.3797906566103178
1708,jamison crowder missed first three game season saw five red zone target week 4 jamison crowder missed first three game season lead team five red zone target week 4,0,0.5595616304491933,0.44043836955080673
213,thielen's cleat today paying respect norm mcdonald,1,0.5763209965525373,0.42367900344746273
1565,giant trade,0,0.5763209965525373,0.42367900344746273
1808,aiyuk break week,0,0.700554272758229,0.299445727241771
1623,yates washington wr terry mclaurin currently owns longest streak target without drop he's seen 190 straight target hauled 128 consecutive catch without drop routinely make difficult absurd catch player,0,0.5763209965525373,0.42367900344746273
579,ever made brett favre movie next year would best actor play,1,0.319661022641885,0.680338977358115
494,josh allen mic'd buffalo bills' shut win houston texan,1,0.3379886975558095,0.6620113024441905
985,colt rb marlon mack trade discussion what's best,0,0.6545318507030484,0.3454681492969516
1797,bear placed rb david montgomery ir activated lb danny trevathan ir also dt akiem hick raider game,0,0.6380414189901018,0.36195858100989825
481,wilson new orleans saint signing running back devine ozigbo jacksonville jaguars' practice squad active roster pending physical according league source former undrafted free agent nebraska signed saint originally 2019,1,0.5531133428687567,0.44688665713124337
349,georgebalekji tom brady bill belichick much made relationship nothing ever accurate see lot respect coach,1,0.11999717170805957,0.8800028282919404
1534,espn possible traded player automatically go starting line,0,0.5763209965525373,0.42367900344746273
370,hdk,1,0.5763209965525373,0.42367900344746273
295,patrick mahomes 14 tds 4 week amount 4 week 2018 mvp season,1,0.5558870695307966,0.4441129304692034
742,schefter lion qb jared goff named week 5 nflpa community mvp distributing 40 000 pound fresh food supply 500 food insecure family detroit,1,0.40885500094320637,0.5911449990567936
945,bengal rb joe mixon tryng walk whatever injury avail far,0,0.8662375917515672,0.13376240824843277
1737,let talk deshaun watson situation,0,0.5763209965525373,0.42367900344746273
9,highlight bengal defense step stop jag 4th inch inside 1,1,0.0728023001283169,0.9271976998716831
1604,top 5 rb target 2021 34 najee harris 29 d'andre swift 22 chase edmonds 22 cordarelle patterson 21 jeremy mcnichols,0,0.8508113785534115,0.14918862144658857
1923,giant rb saquon barkley hobbled look like left ankle foot bench trainer,0,0.7785705563157378,0.2214294436842622
1712,bengal rb joe mixon practice tomorrow see play sunday per zac taylor,0,0.8214649093771047,0.1785350906228953
324,steelers depot aaron rodgers exchange mike tomlin caught camera steelers packer,1,0.5377992515755563,0.46220074842444364
546,nfl week 5 prediction thread 2021 season,1,0.16858616770202317,0.8314138322979768
730,cimini interesting note jason_otc belief john franklin myers hold record largest contract ever signed draft pick cut original team non option year jfm drafted ram 18 cut 19 claimed jet,1,0.3104710950616094,0.6895289049383906
998,viking rb dalvin cook practicing cbs mackensie alexander bashaud breeland back yesterday cb kris boyd te ben ellefson back field yesterday wr ihmir smith marsette,0,0.696149934025803,0.3038500659741969
1481,jonathan taylor target per game year zeke gibson name,0,0.28537333693435063,0.7146266630656494
1124,allen robinson,0,0.609608189802398,0.3903918101976021
588,predict superbowl matchup year,1,0.40480113162625553,0.5951988683737445
1899,official wdis k te def sun evening 10 10 2021,0,0.9160069865018461,0.08399301349815393
1618,wr cb matchup week 5,0,0.700554272758229,0.299445727241771
